_id,title,description,createdBy,createdAt,__v
6703af43d312dda4ba75d8bb,Eveniet tenus deleo subnecto armarium cibo trans cruciamentum circumvenio.,Catena acer sed. Volubilis confugo varius verbum patruus. Textilis commemoro adficio vere cupiditate sufficio desparatus.,6703af3cd312dda4ba75d71d,2024-10-07T09:52:03.293Z,0
6703af43d312dda4ba75d8bd,Communis depraedor angustus sufficio totidem subiungo vitae deporto reiciendis corpus.,Beatus molestiae antea dedico aspicio volva. Venia cui adulatio conventus ventus aqua pax beneficium desidero. Vorago rem texo amplitudo minima umerus sui.,6703af3ed312dda4ba75d795,2024-10-07T09:52:03.317Z,0
6703af43d312dda4ba75d8bf,Copia taedium consectetur ustilo.,Corrupti maiores conicio ater autus tredecim. Quo creator thema stultus depopulo. Amo calamitas quo.,6703af3ed312dda4ba75d7b6,2024-10-07T09:52:03.341Z,0
6703af43d312dda4ba75d8c1,Conspergo apud celebrer laudantium barba articulus.,Nemo arbustum summisse. Desipio demum certe ultio. Textus curatio tot velociter tum despecto.,6703af3ed312dda4ba75d7b0,2024-10-07T09:52:03.364Z,0
6703af43d312dda4ba75d8c3,Cum tricesimus vito bene surculus crux vigor.,Nesciunt basium comes. Amissio virtus spiritus averto spero nam. Conqueror debitis via.,6703af3ad312dda4ba75d6a2,2024-10-07T09:52:03.387Z,0
6703af43d312dda4ba75d8c5,Depraedor velit tenax suggero cinis via aeternus.,Paens super capio adsuesco temperantia apostolus tepidus depono aer abduco. Solutio surgo tametsi coaegresco decumbo tandem adimpleo. Nostrum reprehenderit crinis adulatio.,6703af40d312dda4ba75d834,2024-10-07T09:52:03.411Z,0
6703af43d312dda4ba75d8c7,Vomer caecus constans adfero cimentarius campana.,Deprimo vere sub sustineo fugiat. Ars conicio vestrum alii adeo. Ciminatio turpis appono patruus.,6703af40d312dda4ba75d837,2024-10-07T09:52:03.434Z,0
6703af43d312dda4ba75d8c9,Circumvenio amplitudo stultus stultus subnecto facilis usque caveo vinum.,Copia textus sponte cauda officiis defessus ventito vobis calco. Minus ante auxilium viriliter at cauda admitto sumptus cilicium ustilo. Decipio angelus basium ullam validus circumvenio volup audentia acceptus.,6703af38d312dda4ba75d63f,2024-10-07T09:52:03.459Z,0
6703af43d312dda4ba75d8cb,Culpa adsidue vel tyrannus clamo pecto conforto suasoria.,Sumptus vilis comminor volva quasi sopor vilitas clementia. Verumtamen supplanto vindico volubilis demergo timidus tredecim est. Thymum enim in deprimo.,6703af39d312dda4ba75d66c,2024-10-07T09:52:03.484Z,0
6703af43d312dda4ba75d8cd,Omnis utrum aliquid.,Clamo perspiciatis attollo paens defleo. Bonus ara apto absorbeo totus bellum sollers. Tumultus aeneus ullus pecco aperio aegrotatio admoveo.,6703af37d312dda4ba75d5fd,2024-10-07T09:52:03.511Z,0
6703af43d312dda4ba75d8cf,Terra synagoga thorax thorax vobis officia quibusdam tibi votum triduana.,Patrocinor accedo thalassinus ubi ait voveo. Talis temptatio ara sperno viduo conicio ab beneficium sordeo. Eius angustus esse tactus comis summopere demens sollers congregatio debilito.,6703af40d312dda4ba75d80a,2024-10-07T09:52:03.538Z,0
6703af43d312dda4ba75d8d1,Alienus acsi tepidus custodia trado illo.,Tui excepturi templum summopere. Adipiscor modi curo. Denuncio solio sunt umquam.,6703af3cd312dda4ba75d720,2024-10-07T09:52:03.564Z,0
6703af43d312dda4ba75d8d3,Amita balbus nam asperiores coniuratio at depopulo curo crur.,Defluo voveo distinctio consequatur voco decet crux. Acies quam aegrotatio coerceo. Mollitia laboriosam est vulnero universe artificiose contigo verbum.,6703af37d312dda4ba75d606,2024-10-07T09:52:03.589Z,0
6703af43d312dda4ba75d8d5,Fuga calamitas tantillus solutio confugo corroboro correptius animadverto.,Summopere arto cribro aestivus vetus nobis ut adinventitias. Varius inflammatio speciosus aestas correptius unus cubitum. Maxime argumentum decet vespillo error nisi sono valetudo vel.,6703af3dd312dda4ba75d780,2024-10-07T09:52:03.614Z,0
6703af43d312dda4ba75d8d7,Sonitus apostolus adipisci addo ulciscor abeo sapiente beatae corrumpo comminor.,Anser sopor cibo volup aveho coaegresco adimpleo. Summa delinquo debilito. Celebrer patior aetas artificiose dolorem soluta ipsa.,6703af40d312dda4ba75d825,2024-10-07T09:52:03.640Z,0
6703af43d312dda4ba75d8d9,Correptius currus infit angustus.,Qui alveus coerceo beneficium cubo defetiscor canonicus. Accendo vesper nobis. Autem vix apud beatus copia ad.,6703af39d312dda4ba75d68d,2024-10-07T09:52:03.666Z,0
6703af43d312dda4ba75d8db,Demens chirographum veritas pauci ars vinum aperte talis stips.,Abscido conspergo vindico bellum degusto torqueo vitae necessitatibus. Ars valde cavus color venustas aliquam chirographum cetera. Quo caecus inflammatio sub armarium victoria.,6703af41d312dda4ba75d840,2024-10-07T09:52:03.691Z,0
6703af43d312dda4ba75d8dd,Sollers civis sortitus cogo vespillo sublime iusto basium.,Sublime torqueo deporto amitto spes defessus nihil. Vociferor ater aqua repellat thermae aliquam vitium comburo. Creptio approbo thesis turba.,6703af3dd312dda4ba75d786,2024-10-07T09:52:03.718Z,0
6703af43d312dda4ba75d8df,Verbum amor chirographum tabgo audacia civis valde sopor apparatus.,Bonus tutis terreo depulso in triumphus crustulum aperiam cinis. Decerno uredo averto aspicio. Comptus vestrum comptus totam sustineo doloribus stabilis comptus aliquam.,6703af3dd312dda4ba75d771,2024-10-07T09:52:03.743Z,0
6703af43d312dda4ba75d8e1,Sed itaque tabgo avarus vestigium defleo ambitus.,Atrox soleo vulnero vomito. Pauper cilicium praesentium ulterius cena voluptatibus terga vinum audax. Solus thymum depopulo arcus.,6703af37d312dda4ba75d606,2024-10-07T09:52:03.769Z,0
6703af43d312dda4ba75d8e3,Aureus vindico cometes calco arto absque victus usque explicabo.,Nemo trado caelum asperiores inventore. Deleniti textor degusto sub commodo cognatus suasoria adhuc sui argentum. Tyrannus vivo caveo.,6703af3fd312dda4ba75d7e0,2024-10-07T09:52:03.794Z,0
6703af43d312dda4ba75d8e5,Charisma somniculosus cattus sublime conor.,Pauper cur alius. Cras vergo harum blanditiis adeo appono quasi crebro. Voluntarius vereor arcesso mollitia custodia terga valetudo vapulus deficio cum.,6703af3dd312dda4ba75d774,2024-10-07T09:52:03.822Z,0
6703af43d312dda4ba75d8e7,Curia triduana appositus ventito suscipit.,Stips agnosco conor vomer villa. Sursum aegre officiis corpus caste curis aperio. Sopor utor tener veritatis vulticulus.,6703af3cd312dda4ba75d720,2024-10-07T09:52:03.848Z,0
6703af43d312dda4ba75d8e9,Caritas volutabrum velociter conservo benigne pecco curia eius substantia.,Cohibeo conforto vorax constans. Defungo repudiandae stabilis. Aurum civitas urbs vapulus thymbra comparo caveo.,6703af3ed312dda4ba75d79b,2024-10-07T09:52:03.874Z,0
6703af43d312dda4ba75d8eb,Stabilis avarus placeat tamisium vesper cum arcus aut sol.,Verbum delicate apto saepe sit audax aedificium commemoro certus color. Conatus aut aggero spes deficio cinis aperiam unde constans demitto. Demergo benigne magni aro.,6703af3dd312dda4ba75d774,2024-10-07T09:52:03.898Z,0
6703af43d312dda4ba75d8ed,Reprehenderit utor laboriosam ab arbitro summopere utrimque usus uter.,Supplanto aurum cernuus video decimus calculus canis suscipit. Impedit patria admoneo molestiae laudantium utilis vel. Coerceo tardus vacuus.,6703af36d312dda4ba75d5f4,2024-10-07T09:52:03.922Z,0
6703af43d312dda4ba75d8ef,Vulpes ventosus neque.,Adopto volaticus virga tametsi adamo cattus via credo coruscus. Utrimque cognomen eaque denuncio vinculum pecus. Solum arcesso est.,6703af3ed312dda4ba75d792,2024-10-07T09:52:03.945Z,0
6703af43d312dda4ba75d8f1,Reprehenderit testimonium synagoga clibanus degenero adinventitias.,Tam viduo comminor crur. Tantum ustulo crapula corona beatae brevis suppellex aqua. Totidem comminor coaegresco textus aeneus cur tener cauda.,6703af3ed312dda4ba75d7a1,2024-10-07T09:52:03.971Z,0
6703af43d312dda4ba75d8f3,Suffoco vel congregatio approbo tripudio amoveo repudiandae.,Voluptas consuasor ad arguo territo cena tredecim cupio alii vacuus. Crapula architecto alioqui. Valens basium ante subseco venio auctus suffoco defero amo ademptio.,6703af3fd312dda4ba75d7ec,2024-10-07T09:52:03.997Z,0
6703af44d312dda4ba75d8f5,Aspicio peior arbitro amissio iusto maxime cupressus.,Synagoga amo sumo decor causa voluptate iure. Contra vociferor abscido adipisci barba tutis. Provident tepesco arbitro itaque bibo comminor sollicito tum catena.,6703af3ed312dda4ba75d78c,2024-10-07T09:52:04.024Z,0
6703af44d312dda4ba75d8f7,Curso aestas temperantia.,Colo sono uxor conor spes pel sub cibus uredo. Cultellus vulgivagus depono vulnus aliqua adversus. Vulnus terror via atque solitudo thesaurus argentum depraedor timidus.,6703af3cd312dda4ba75d732,2024-10-07T09:52:04.050Z,0
6703af44d312dda4ba75d8f9,Tertius curatio tutis adnuo aurum.,Tunc aedificium cariosus conscendo bellum. Ipsa vigor culpo vociferor vitium ascisco conturbo aperio tepesco. Cicuta utroque tonsor tergum curso conduco valens.,6703af38d312dda4ba75d636,2024-10-07T09:52:04.076Z,0
6703af44d312dda4ba75d8fb,Mollitia cupio desino.,Trepide deleo ancilla eum tristis tabella dolore colligo surculus reiciendis. Strenuus abduco currus. Corrupti condico antiquus trado desipio tyrannus utilis aegrotatio administratio.,6703af40d312dda4ba75d819,2024-10-07T09:52:04.102Z,0
6703af44d312dda4ba75d8fd,Capillus omnis ipsum temperantia clamo viridis aurum custodia antiquus.,Benevolentia undique strues optio casso dedico. Defaeco atavus sono comptus. Solum alo magni facilis caelestis spes.,6703af40d312dda4ba75d813,2024-10-07T09:52:04.128Z,0
6703af44d312dda4ba75d8ff,Ullus thorax auctor paulatim tabella.,Conitor barba vir sumptus facere coruscus thesis temporibus. Abundans caput pauci cerno aetas victoria. Ventosus advenio agnosco ulterius vos atrox abscido statua conscendo aggredior.,6703af40d312dda4ba75d828,2024-10-07T09:52:04.153Z,0
6703af44d312dda4ba75d901,Alveus quas blanditiis attero coadunatio.,Sumptus xiphias collum cunabula cognomen admoneo. Articulus antepono vere basium vae cunctatio ambitus animi arbor. Carmen placeat circumvenio cupressus casus theologus sapiente subvenio vero defetiscor.,6703af39d312dda4ba75d66f,2024-10-07T09:52:04.178Z,0
6703af44d312dda4ba75d903,Spiculum nihil denique articulus alveus.,Patruus adflicto sustineo damnatio sit expedita aeternus commemoro. Illum absum deficio facilis suus volo admitto. Defetiscor tergiversatio tres una.,6703af3bd312dda4ba75d708,2024-10-07T09:52:04.204Z,0
6703af44d312dda4ba75d905,Cilicium totidem creo.,Dedecor delectus ciminatio. Appono curiositas atque reiciendis eligendi itaque facere thesis talus sint. Audax conor charisma caute.,6703af41d312dda4ba75d85e,2024-10-07T09:52:04.230Z,0
6703af44d312dda4ba75d907,Tepesco considero convoco.,Correptius auxilium alioqui conqueror sordeo commodi ubi dens trado spectaculum. Tergum audax ultio custodia nesciunt cauda textus. Quam sum defluo colo cunae valetudo corrupti ustulo doloremque.,6703af3bd312dda4ba75d6db,2024-10-07T09:52:04.501Z,0
6703af44d312dda4ba75d909,Saepe earum ambulo vinitor undique censura aer cito.,Rem ustulo vel aptus tero claudeo trado tardus tum. Demitto atavus pel subnecto demonstro demens temporibus agnitio comminor. Vulariter claustrum vesper non beneficium combibo celo.,6703af3fd312dda4ba75d7d7,2024-10-07T09:52:04.528Z,0
6703af44d312dda4ba75d90b,Voluptatibus hic victoria cibus cimentarius.,Cavus tamen auctor laborum concedo ocer confero coadunatio. Civis trucido voco velum cunabula. Aequus debeo dolorem.,6703af3bd312dda4ba75d714,2024-10-07T09:52:04.555Z,0
6703af44d312dda4ba75d90d,Somnus verus conculco abeo tracto summa deinde.,Ulterius ago damno suppellex temeritas. Thesis occaecati ventus adamo. Aperio derideo tredecim.,6703af38d312dda4ba75d645,2024-10-07T09:52:04.581Z,0
6703af44d312dda4ba75d90f,Undique color contra votum summa vinco.,Benevolentia valens sto. Adinventitias altus appositus attonbitus decor abundans pariatur. Repellat contra civitas excepturi saepe statim verbum.,6703af42d312dda4ba75d8a6,2024-10-07T09:52:04.607Z,0
6703af44d312dda4ba75d911,Beatae maxime venia adflicto sublime.,Id deleo quasi confugo vos cras vorax amplitudo beneficium concedo. Crapula suus vox subnecto abutor non vester. Acidus defendo cenaculum carbo urbanus vetus vallum balbus possimus timor.,6703af41d312dda4ba75d840,2024-10-07T09:52:04.630Z,0
6703af44d312dda4ba75d913,Solvo vomica vomica vulgivagus.,Maxime deporto dolore sub spiculum cedo tenus turpis mollitia. Vomica ante carpo aegrus alter compello. Canonicus thema defleo enim suus.,6703af40d312dda4ba75d816,2024-10-07T09:52:04.655Z,0
6703af44d312dda4ba75d915,Explicabo concido sopor astrum civis tricesimus coadunatio theologus vulgivagus.,Iusto colligo debeo triduana crapula velum. Pariatur tristis beatae. Clibanus depraedor annus corporis magnam in adipisci tumultus.,6703af43d312dda4ba75d8ac,2024-10-07T09:52:04.681Z,0
6703af44d312dda4ba75d917,Thorax civis stella basium beneficium volutabrum tristis excepturi armarium super.,Sufficio caelestis adicio. Benigne calculus cenaculum valeo pecto cattus ultio stabilis aperiam ars. Summa testimonium vilitas aperte aspernatur.,6703af40d312dda4ba75d80d,2024-10-07T09:52:04.708Z,0
6703af44d312dda4ba75d919,Venia audacia tabella architecto appositus conservo sordeo.,Adhuc stabilis aiunt tabesco curriculum deprecator tollo apparatus certus. Stips caterva tero delectus carbo astrum undique thorax catena. Admiratio terror clam.,6703af3cd312dda4ba75d717,2024-10-07T09:52:04.733Z,0
6703af44d312dda4ba75d91b,Decor subito acsi consuasor consequuntur ad.,Substantia corporis odio neque angelus adeo speciosus stipes. Utroque ait aliquam ratione tabula. Adsuesco architecto verbera.,6703af42d312dda4ba75d873,2024-10-07T09:52:04.756Z,0
6703af44d312dda4ba75d91d,Mollitia damno beatae sonitus artificiose patruus.,Cuppedia armarium arto. Distinctio valetudo temptatio cohibeo voluptatum crastinus curiositas virgo delego utor. Acsi correptius clibanus condico vigilo aggero fugit.,6703af3fd312dda4ba75d7d7,2024-10-07T09:52:04.781Z,0
6703af44d312dda4ba75d91f,Cursus tracto subnecto arca cogo iure ciminatio.,Artificiose vindico argentum volup caterva corrumpo suggero admoneo. In curso ancilla vesica tempora usus deporto. Vulariter barba sulum.,6703af39d312dda4ba75d699,2024-10-07T09:52:04.806Z,0
6703af44d312dda4ba75d921,Stabilis cunctatio causa apparatus verbera sulum corrumpo allatus.,Tamdiu quisquam surculus. Charisma pauci apud ventosus abutor succurro trucido acsi. Apparatus adsidue ex tutis conforto pectus vespillo.,6703af42d312dda4ba75d89a,2024-10-07T09:52:04.832Z,0
6703af44d312dda4ba75d923,Texo iste degusto voluptas vulgus sophismata tergo utpote.,Animi traho vado super terminatio coadunatio. Calco tersus suffragium amissio sed. Veniam corrumpo audeo adipiscor.,6703af37d312dda4ba75d62d,2024-10-07T09:52:04.857Z,0
6703af44d312dda4ba75d925,Condico tamen aurum.,Sumptus attero alias decet conatus alter adipiscor. Volutabrum verbera verto cohors carmen audeo copia. Umquam vespillo triumphus carcer videlicet crudelis utilis speciosus trucido aeternus.,6703af3ed312dda4ba75d795,2024-10-07T09:52:04.883Z,0
6703af44d312dda4ba75d927,Alioqui cometes delicate sumo creber auctor.,Adicio acerbitas consectetur ter velit ascit argumentum error. Comminor corroboro tenus tres tempore et certe cunae adsidue currus. Clam ustulo abeo animadverto ascit magni theatrum acidus.,6703af39d312dda4ba75d675,2024-10-07T09:52:04.909Z,0
6703af44d312dda4ba75d929,Summa caute spero adduco.,Cui amissio artificiose delectatio ter apparatus. Sint pectus coruscus cognatus depopulo admoneo vinum aptus voluptates. Talis eligendi usque.,6703af37d312dda4ba75d60f,2024-10-07T09:52:04.935Z,0
6703af44d312dda4ba75d92b,Alias pax tener coruscus vita cuppedia arma tempore suggero.,Conspergo cilicium nesciunt subnecto curis dicta cimentarius administratio turpis. Tabernus colligo soluta pax totidem annus ea. Cotidie vos impedit cubicularis amaritudo theatrum administratio dicta aqua.,6703af37d312dda4ba75d62a,2024-10-07T09:52:04.962Z,0
6703af44d312dda4ba75d92d,Abutor quia ademptio valens cuius.,Validus conculco adsum rerum aequitas inflammatio. Casus umbra averto tamisium cupiditate tremo clamo voluntarius vulgaris. Pariatur id vitae cohibeo pariatur demens tenetur toties accommodo.,6703af3fd312dda4ba75d7d7,2024-10-07T09:52:04.988Z,0
6703af45d312dda4ba75d92f,Usque amissio bibo conqueror.,Utilis cohaero territo cena contigo vado audentia torrens. Allatus civitas thymbra acies rem unde thema voveo sint ea. Thesis claudeo suggero damno calco vesco angustus hic.,6703af43d312dda4ba75d8ac,2024-10-07T09:52:05.015Z,0
6703af45d312dda4ba75d931,Labore taedium dolor quam cogito acsi bos abscido cernuus et.,Ager sed vesper circumvenio. Consequatur dolorum conturbo sponte cinis. Carmen ver cunctatio copia avaritia sursum vigor amissio tunc acidus.,6703af3dd312dda4ba75d777,2024-10-07T09:52:05.042Z,0
6703af45d312dda4ba75d933,Consequuntur quo utor pauper.,Cado tunc tantum thema speculum libero calculus nam. Denuncio cunabula usitas carcer acceptus vetus adfero veritas celebrer. Defessus averto demergo vomer solium crudelis.,6703af3ed312dda4ba75d78c,2024-10-07T09:52:05.068Z,0
6703af45d312dda4ba75d935,Carus suppono timor aedificium quis ducimus tibi teneo ventito.,Solus volaticus communis contabesco cras commodo suscipio eaque vesper cur. Illum acidus uredo quas patruus tremo solum apud adulescens. Temptatio solio excepturi fuga aeger aufero attonbitus verbera turbo.,6703af3cd312dda4ba75d74a,2024-10-07T09:52:05.095Z,0
6703af45d312dda4ba75d937,Amiculum tamen enim contego bonus.,Artificiose stipes viscus vae teneo audio traho paulatim bos. Carcer aureus tenuis cinis carpo acies comburo. Cado verecundia charisma exercitationem coadunatio velut placeat cerno.,6703af3bd312dda4ba75d6e1,2024-10-07T09:52:05.121Z,0
6703af45d312dda4ba75d939,Utpote argentum super brevis animus demens appositus pariatur vociferor dolore.,Subvenio natus texo atrocitas. Sophismata viduo vulpes demulceo accusator decerno super theca. Itaque crepusculum vere coniecto voluptate.,6703af3ad312dda4ba75d6a2,2024-10-07T09:52:05.145Z,0
6703af45d312dda4ba75d93b,Tribuo conatus utor eum sunt voro.,Deripio degero iste debeo. Suscipit desino solio torrens solitudo cultura. Velut auctus arcus ascit cena bos adficio terebro.,6703af39d312dda4ba75d690,2024-10-07T09:52:05.169Z,0
6703af45d312dda4ba75d93d,Censura adfectus tero recusandae basium.,Barba denuncio victus arca. Arma sui velut vado confugo acies eaque. Officia tactus aspicio substantia corrupti ambulo nemo crepusculum.,6703af3ed312dda4ba75d7bf,2024-10-07T09:52:05.194Z,0
6703af45d312dda4ba75d93f,Tergeo venustas tempora color accendo triumphus spargo.,Consuasor clibanus tenuis ago coma pauci acsi arx benevolentia. Tutamen compono umquam defluo sint asporto vir vacuus. Sub conculco vorago timidus bos deprecator.,6703af38d312dda4ba75d645,2024-10-07T09:52:05.221Z,0
6703af45d312dda4ba75d941,Paens aestus quidem cruentus amissio dolor aliquam adeptio adipiscor.,Umquam confido defero cruciamentum vallum. Beneficium tabesco aequitas dedico desolo summopere tenuis vallum copiose unde. Vulticulus tergeo cognomen.,6703af3ad312dda4ba75d6c0,2024-10-07T09:52:05.247Z,0
6703af45d312dda4ba75d943,Harum vigor avarus creator.,Acidus volo est aeternus spero abutor quo capio vereor crux. Apto ustilo curis vapulus. Blanditiis similique usque vulpes argumentum ea accommodo capto aetas averto.,6703af36d312dda4ba75d5eb,2024-10-07T09:52:05.274Z,0
6703af45d312dda4ba75d945,Amor aduro toties provident bestia utique arbustum curtus.,Ceno certe taceo basium artificiose voluntarius. Tollo defungo vitium claustrum venia usque sollers aeneus eius. Defaeco vestrum cenaculum cupiditate thermae aut.,6703af3ed312dda4ba75d789,2024-10-07T09:52:05.302Z,0
6703af45d312dda4ba75d947,Despecto vestigium dens.,Accusamus cariosus aduro vulgivagus bellum. Attollo tantillus caelestis ager. Magnam defaeco aranea laboriosam impedit adipisci.,6703af40d312dda4ba75d819,2024-10-07T09:52:05.328Z,0
6703af45d312dda4ba75d949,Valeo vinco compono villa nihil taedium.,Commodi admiratio custodia pecto triumphus constans vinco. Dolorum tantillus benigne truculenter fugiat tabula corrigo. Agnosco carcer torrens iusto abbas vilitas tutamen usitas ratione.,6703af37d312dda4ba75d621,2024-10-07T09:52:05.354Z,0
6703af45d312dda4ba75d94b,Ipsa vomito rerum suus theologus.,Facilis delinquo amita sum suffragium absens cotidie. Terga tero voluptatibus appello molestiae sub desino vado. Sumptus arbor virgo teres.,6703af38d312dda4ba75d648,2024-10-07T09:52:05.378Z,0
6703af45d312dda4ba75d94d,Officia adinventitias acies bene claudeo decumbo armarium communis vel.,Cavus thalassinus aveho beneficium eum creo. Error agnosco tonsor. Adulatio vita alo tracto tersus verbum.,6703af37d312dda4ba75d621,2024-10-07T09:52:05.401Z,0
6703af45d312dda4ba75d94f,Alii attero quasi solum tergiversatio candidus cometes aestivus creta cumque.,Aurum concedo tam vicinus corona. Adnuo beatae bestia. Admoneo commodi aggredior amitto altus tardus.,6703af3dd312dda4ba75d753,2024-10-07T09:52:05.433Z,0
6703af45d312dda4ba75d951,Deprecator verumtamen beneficium voluptatum depono nihil cauda stultus amplexus.,Dicta aequitas antiquus turpis corroboro subvenio. Victus ter at decimus vesco cibo. Atrocitas atrox quasi trans comminor adversus libero charisma succurro adopto.,6703af3ad312dda4ba75d6c9,2024-10-07T09:52:05.459Z,0
6703af45d312dda4ba75d953,Censura tollo sufficio sursum arbustum.,Abscido decor iste adopto despecto pectus deludo supellex adduco varietas. Tutis aiunt quae quisquam ambulo succurro argentum subvenio cubicularis. Cauda aro undique tendo necessitatibus voro eos demulceo.,6703af37d312dda4ba75d618,2024-10-07T09:52:05.483Z,0
6703af45d312dda4ba75d955,Cumque synagoga viduo vallum verbera vilitas coerceo absens atrocitas.,Viridis adiuvo stabilis desparatus solium. Supellex aestus sto decumbo vis. Confero conor cicuta tui alo sordeo cum.,6703af3dd312dda4ba75d77d,2024-10-07T09:52:05.507Z,0
6703af45d312dda4ba75d957,Conicio balbus cunae.,Admitto sapiente cruciamentum explicabo. Explicabo tergo excepturi calco carbo rem terga auctor amplitudo antea. Stips creber ultra deorsum corpus torqueo.,6703af38d312dda4ba75d65a,2024-10-07T09:52:05.530Z,0
6703af45d312dda4ba75d959,Accendo decumbo colo allatus.,Urbs demens demoror velit. Molestiae cognomen fuga. Abutor comburo adhaero recusandae enim.,6703af3cd312dda4ba75d741,2024-10-07T09:52:05.556Z,0
6703af45d312dda4ba75d95b,Vesper deludo numquam officiis ventus curiositas abstergo neque maxime.,Sint comptus appositus accusator una defaeco ventito vel. Appositus depulso coaegresco animus aveho tutis advenio vulticulus totidem defetiscor. Curriculum aiunt vir.,6703af41d312dda4ba75d85e,2024-10-07T09:52:05.583Z,0
6703af45d312dda4ba75d95d,Tabgo thymum aestivus communis.,Numquam arma uberrime talus arbor nemo alveus adicio patria tametsi. Ustulo addo verbum unde cavus peior crustulum canis corrupti comminor. Vomer sperno caecus coerceo nemo claudeo verbera.,6703af40d312dda4ba75d82b,2024-10-07T09:52:05.609Z,0
6703af45d312dda4ba75d95f,Vulnus aestas certe.,Abutor casso thalassinus venia. Vulpes esse sonitus. Debeo uredo damno sublime vilicus commemoro caput utilis beneficium adsum.,6703af39d312dda4ba75d687,2024-10-07T09:52:05.636Z,0
6703af45d312dda4ba75d961,Sonitus comitatus sed.,Deputo cupio appono. Conor sustineo blandior cetera ademptio aveho amplexus. Valens vitiosus adeptio.,6703af3bd312dda4ba75d6ea,2024-10-07T09:52:05.661Z,0
6703af45d312dda4ba75d963,Tollo expedita desipio fugit cubo cunctatio depereo careo.,Surgo decretum harum earum carpo absconditus tot. Vergo dolor acerbitas doloremque articulus adaugeo. Tantum crastinus ea victoria saepe balbus calculus accommodo.,6703af39d312dda4ba75d687,2024-10-07T09:52:05.684Z,0
6703af45d312dda4ba75d965,Solum vinum bonus uter concedo dolorum conculco.,Repellat acidus ulterius conventus. Supplanto bos consequatur curis vere defessus defaeco celo. Vilicus similique synagoga.,6703af41d312dda4ba75d840,2024-10-07T09:52:05.709Z,0
6703af45d312dda4ba75d967,Canto magnam tracto aequus.,Vulgo cibo summa ter tubineus. Assentator claustrum copiose teres adhuc tergum conculco quisquam. Sublime excepturi vitae termes usus vulgivagus cognomen umquam stella totam.,6703af3ed312dda4ba75d7ad,2024-10-07T09:52:05.736Z,0
6703af45d312dda4ba75d969,Sapiente bibo terror depopulo adnuo.,Tametsi aggredior amiculum sequi asperiores contego degero votum desino casus. Undique quia aegrus denique. Verecundia alo concedo harum charisma suffragium desipio porro.,6703af3cd312dda4ba75d72f,2024-10-07T09:52:05.759Z,0
6703af45d312dda4ba75d96b,Depromo vereor aestus caries summopere copiose totus.,Amoveo aeneus coniuratio corpus. Nobis advoco amitto alius admiratio. Adeo umerus derideo omnis amitto chirographum cuppedia apto.,6703af37d312dda4ba75d600,2024-10-07T09:52:05.783Z,0
6703af45d312dda4ba75d96d,Ex deporto illo temporibus sursum eaque vel vinitor arguo.,Synagoga commodi tripudio tolero defungo trans. Laborum brevis aufero arx. Demulceo temporibus convoco vinco sulum cometes.,6703af39d312dda4ba75d690,2024-10-07T09:52:05.808Z,0
6703af45d312dda4ba75d96f,Apparatus cito pel.,Placeat fugiat adipiscor deduco degusto. Accommodo tersus cariosus crapula quasi deorsum crux degenero vere beneficium. Audio artificiose aliqua.,6703af3bd312dda4ba75d6f3,2024-10-07T09:52:05.835Z,0
6703af45d312dda4ba75d971,Vulgaris veritas ter sortitus.,Delicate supellex explicabo vetus comes. Amplexus ascisco anser. Approbo suffoco curtus impedit turpis teres tergo delego tego apparatus.,6703af42d312dda4ba75d89d,2024-10-07T09:52:05.861Z,0
6703af45d312dda4ba75d973,Adsum cogito aro sortitus vere.,Earum cupio cavus advenio. Expedita torqueo comitatus approbo. Abeo quam adinventitias cunctatio.,6703af42d312dda4ba75d876,2024-10-07T09:52:05.886Z,0
6703af45d312dda4ba75d975,Quas sponte stips vita.,Creator perspiciatis atavus taceo. Bonus crepusculum ad tabesco crapula tabula desparatus. Curatio perferendis cribro creptio temptatio temperantia.,6703af3ed312dda4ba75d7aa,2024-10-07T09:52:05.911Z,0
