_id,title,description,createdBy,createdAt,__v
6703af50d312dda4ba75dc5f,Somnus vulariter terror vere templum demulceo candidus acceptus aureus sodalitas.,Accusator allatus certus. Tergum coniuratio valde cunctatio decumbo. Aliqua velut cetera mollitia.,6703af3fd312dda4ba75d7f2,2024-10-07T09:52:16.369Z,0
6703af50d312dda4ba75dc61,Hic beatus crebro animi demulceo.,Vesco vulnus officia cornu exercitationem derelinquo cultura modi. Angustus tutamen vallum tumultus sunt commodo. Confugo cohaero dolor cubo comburo aurum vestigium crastinus antea curto.,6703af42d312dda4ba75d894,2024-10-07T09:52:16.395Z,0
6703af50d312dda4ba75dc63,Deinde virgo tres vilicus id.,Thesaurus tabella valde demum inflammatio velit verbum assentator. Veniam derideo aliqua patria vilitas comburo decet custodia. Debitis angulus acsi copiose inventore depromo theologus pecus.,6703af37d312dda4ba75d60c,2024-10-07T09:52:16.422Z,0
6703af50d312dda4ba75dc65,Subito excepturi unus dignissimos arca.,Odit via vulgus theologus sursum. Et vulnero alias. Vestrum cedo in pectus adeo ventosus adeptio curto cenaculum.,6703af3ed312dda4ba75d7b6,2024-10-07T09:52:16.446Z,0
6703af50d312dda4ba75dc67,Arx corrigo venia accusator consequuntur bestia.,Torrens aetas et harum. Callide adnuo bellicus ad somnus vetus curso bellicus auctus. Adficio thalassinus calculus tamquam coniuratio causa consequatur pauper.,6703af3cd312dda4ba75d729,2024-10-07T09:52:16.471Z,0
6703af50d312dda4ba75dc69,Taedium viridis sit comes tergum quia culpo.,Sunt torqueo numquam atavus trado taceo argumentum porro. Denuo distinctio cruciamentum vapulus dedecor abeo. Contabesco decipio deorsum currus alias laudantium talus calculus absens.,6703af42d312dda4ba75d888,2024-10-07T09:52:16.496Z,0
6703af50d312dda4ba75dc6b,Atqui deludo comptus stipes consuasor adaugeo.,Autus amor modi vitium dedico complectus labore cicuta vereor adfectus. Sollicito vestrum acervus patruus argentum succurro defessus aliqua tumultus. Accedo caelestis nemo deleo appono adopto.,6703af41d312dda4ba75d83d,2024-10-07T09:52:16.763Z,0
6703af50d312dda4ba75dc6d,Quos voluptates amitto aut.,Adflicto antea adeo aro aegrotatio decor deprimo. Ventus clarus vorax reiciendis. Occaecati viridis constans approbo virgo cognatus incidunt agnosco animus.,6703af3bd312dda4ba75d6fc,2024-10-07T09:52:16.786Z,0
6703af50d312dda4ba75dc6f,Cernuus tenax recusandae statua caput coma solutio impedit.,Atrocitas vaco cariosus dignissimos deorsum pel cibo tabernus corpus. Demens cito architecto quos vae suggero averto. Adipisci ascisco antea aspernatur adnuo voluptatem.,6703af3ed312dda4ba75d78f,2024-10-07T09:52:16.809Z,0
6703af50d312dda4ba75dc71,Votum porro dolorum carpo vesco corroboro confugo consuasor atrox complectus.,Cubicularis adopto allatus timor. Adnuo xiphias possimus demo vestrum. Vilicus debitis deprecator taceo vita.,6703af3cd312dda4ba75d71a,2024-10-07T09:52:16.834Z,0
6703af50d312dda4ba75dc73,Tametsi harum conventus temperantia autus caries arcus.,Neque attollo civis clementia minus caecus delectatio verto viridis tempore. Adsidue inflammatio sursum taedium testimonium sursum carus cogo victoria calculus. Vespillo stipes color eaque nisi comitatus consuasor.,6703af3ed312dda4ba75d78f,2024-10-07T09:52:16.860Z,0
6703af50d312dda4ba75dc75,Theologus villa aranea abscido conculco crustulum decipio.,Commodi capillus suus. Admiratio esse accusamus carcer stillicidium vulticulus abutor approbo. Audeo vir viscus valetudo.,6703af43d312dda4ba75d8af,2024-10-07T09:52:16.887Z,0
6703af50d312dda4ba75dc77,Suscipio verecundia absorbeo celebrer illum aufero vulpes ex timor.,Alius claustrum alveus adipiscor iste damno. Aperiam minima ad vitae sit vilicus vobis. Defendo somniculosus certus adulescens abscido desino.,6703af41d312dda4ba75d861,2024-10-07T09:52:16.913Z,0
6703af50d312dda4ba75dc79,Defluo apparatus barba combibo ante ventosus.,Bis tabernus sol. Tamen coniuratio adfectus conculco vere vere illum canonicus perferendis sui. Cibus armarium nostrum vigilo nam ascisco non somnus texo.,6703af37d312dda4ba75d60f,2024-10-07T09:52:16.939Z,0
6703af50d312dda4ba75dc7b,Sperno adimpleo amicitia solvo videlicet ceno.,Utilis illum conatus armarium modi. Triumphus delego tertius cogito calco vapulus utrimque vix. Talio audax mollitia basium balbus.,6703af3cd312dda4ba75d735,2024-10-07T09:52:16.966Z,0
6703af50d312dda4ba75dc7d,Verto sursum suasoria utique cunae.,Antiquus ambulo considero cupiditas. Cresco celo adduco calco cattus eius stillicidium adhuc. Amplitudo demulceo centum nemo.,6703af41d312dda4ba75d85b,2024-10-07T09:52:16.992Z,0
6703af51d312dda4ba75dc7f,Demum qui conor usitas curia culpa defungo consectetur terminatio.,Arceo suffragium supellex valde ultio demo voluptatibus. Varius volubilis cuppedia colo stips praesentium torrens admoneo pauci voluptatum. Vita ago consuasor delibero.,6703af3dd312dda4ba75d762,2024-10-07T09:52:17.017Z,0
6703af51d312dda4ba75dc81,Tribuo adulatio totam tabgo constans aestivus ager vociferor usus.,Ceno desolo abduco. Tenetur cena acerbitas ascisco. Auctor suadeo vicinus cado quos.,6703af3dd312dda4ba75d76b,2024-10-07T09:52:17.041Z,0
6703af51d312dda4ba75dc83,Supellex ad canonicus antiquus adiuvo conitor colo.,Cedo velociter cenaculum arbor vomer cum bonus considero ascisco. Cupiditate tumultus assumenda. Arca concido cervus.,6703af39d312dda4ba75d69f,2024-10-07T09:52:17.064Z,0
6703af51d312dda4ba75dc85,Voluptate neque voluptas damnatio deputo.,Audentia caveo thalassinus. Aliquid desolo vorax ancilla conor apto. Viridis copiose verto volutabrum ademptio minus comptus decimus attero.,6703af3cd312dda4ba75d72c,2024-10-07T09:52:17.088Z,0
6703af51d312dda4ba75dc87,Talio acidus solutio crur dignissimos bellicus tego.,Verecundia demergo aliqua omnis terra surgo considero. Quae claudeo suscipit depraedor contigo. Eaque subvenio corroboro tactus quia adsum credo.,6703af3ed312dda4ba75d7a1,2024-10-07T09:52:17.114Z,0
6703af51d312dda4ba75dc89,Dolorem adfero varius saepe patior.,Illum ocer civitas vorax deripio. Sufficio placeat mollitia terminatio utrimque video caries animi. Sunt credo audentia iusto alias crudelis adulescens amita.,6703af37d312dda4ba75d627,2024-10-07T09:52:17.139Z,0
6703af51d312dda4ba75dc8b,Vaco tertius alienus dolorum ustilo speciosus audeo spargo.,Ultio adficio cariosus ulciscor magni apud aptus. Cornu iusto quisquam cado ipsa defaeco nihil. Enim confido vorax appono tabula antea timor viscus tutamen.,6703af3fd312dda4ba75d7e0,2024-10-07T09:52:17.164Z,0
6703af51d312dda4ba75dc8d,Deorsum totidem urbs adeo deprimo talio tutamen solium autus.,Quisquam cruciamentum cubo supra clementia ultra cultura abstergo tabgo adeo. Torqueo repudiandae thorax alii. Decimus cohors cerno amiculum cresco.,6703af41d312dda4ba75d867,2024-10-07T09:52:17.190Z,0
6703af51d312dda4ba75dc8f,Crux dens arma inventore ago bene numquam tempora culpo tego.,Crustulum amita amplus antea. Vacuus tamquam corrigo textor. Libero corrigo nemo a aetas vapulus creo pecto.,6703af3dd312dda4ba75d750,2024-10-07T09:52:17.218Z,0
6703af51d312dda4ba75dc91,Corrumpo vestrum reprehenderit deporto.,Thesaurus laudantium patria defessus absque virga tum crux curso saepe. Deficio anser sub conor cunctatio quaerat necessitatibus. Eligendi deficio titulus cupio.,6703af41d312dda4ba75d864,2024-10-07T09:52:17.244Z,0
6703af51d312dda4ba75dc93,Rerum colligo ipsa concedo sperno viscus aliqua quidem.,Summa demitto damno contabesco curis verbera appositus annus sponte agnitio. Creptio temperantia demoror tenetur. Vehemens conturbo carmen carbo campana facere crepusculum sequi decipio convoco.,6703af3dd312dda4ba75d76e,2024-10-07T09:52:17.269Z,0
6703af51d312dda4ba75dc95,Virgo ascit cicuta facilis.,Temporibus pecco demonstro molestias amita caries beneficium odio copia. Tantum timor dolores patria viriliter ater. Cogo verto cubo.,6703af3ad312dda4ba75d6ab,2024-10-07T09:52:17.295Z,0
6703af51d312dda4ba75dc97,Eum arguo subvenio delinquo contabesco nihil combibo aliquam.,Denuo numquam totus. Dolore tumultus victus administratio. Cunae certe aegrus vicinus.,6703af3fd312dda4ba75d7e9,2024-10-07T09:52:17.322Z,0
6703af51d312dda4ba75dc99,Delego cometes suppellex casso terror nemo cicuta uberrime.,Sursum cribro pauper ago. Auditor calcar despecto speciosus copiose dedico. Depono angelus ademptio voluptatem acies delectus.,6703af42d312dda4ba75d879,2024-10-07T09:52:17.347Z,0
6703af51d312dda4ba75dc9b,Tabernus assumenda compono solium.,Adfectus aiunt sol aperte curo. Ager talus trado cedo asporto cibus sum contigo cado. Sapiente paens cenaculum cuppedia autus.,6703af3fd312dda4ba75d7f2,2024-10-07T09:52:17.373Z,0
6703af51d312dda4ba75dc9d,Demergo maxime aliquid demum casso attonbitus utroque cupiditas aer venustas.,Atqui deludo auxilium solitudo concedo crinis stultus teres vos. Condico cunabula succurro ambitus vesper cupio. Cohibeo taedium delinquo vaco dolore suffragium colo undique.,6703af39d312dda4ba75d68a,2024-10-07T09:52:17.400Z,0
6703af51d312dda4ba75dc9f,Adulatio a coaegresco conventus pectus aut.,Decerno testimonium alter via astrum subnecto admoneo ulciscor. Fuga vomito patior veritatis vorago consequuntur nihil video. Cotidie arcesso modi.,6703af3ed312dda4ba75d7b3,2024-10-07T09:52:17.425Z,0
6703af51d312dda4ba75dca1,Antea audeo vinitor.,Auditor cornu vitium eos arcus valde debitis. Verbera voluptates aspicio. Patrocinor cunabula accedo alias contra desolo dolor numquam.,6703af3fd312dda4ba75d7dd,2024-10-07T09:52:17.449Z,0
6703af51d312dda4ba75dca3,Inflammatio censura placeat.,Beatus stips amita iste adstringo dolore demergo veniam. Ater allatus vulticulus deleo benigne pax tibi deorsum. Cohors cauda tyrannus suppellex iusto vociferor tempus argumentum et in.,6703af3ed312dda4ba75d795,2024-10-07T09:52:17.475Z,0
6703af51d312dda4ba75dca5,Numquam iure dolorem stultus surculus tabesco eius.,Impedit bonus tenuis alioqui. Calculus casso color vaco. Ab brevis correptius testimonium.,6703af3bd312dda4ba75d702,2024-10-07T09:52:17.501Z,0
6703af51d312dda4ba75dca7,Depereo conculco aliqua comedo dignissimos.,Cicuta creo pel. Debilito solum suppellex verus velum verumtamen tracto adipiscor conatus. Celo adicio pax paens.,6703af3bd312dda4ba75d714,2024-10-07T09:52:17.529Z,0
6703af51d312dda4ba75dca9,Earum modi crur auxilium vindico modi coma creo.,Claudeo harum voluptatem decerno altus communis vorax sufficio creo talis. Cunctatio quae sollicito contra ratione suffragium. Derideo addo auxilium denuo convoco calamitas deleo facilis.,6703af38d312dda4ba75d645,2024-10-07T09:52:17.555Z,0
6703af51d312dda4ba75dcab,Aurum venia recusandae confugo coniecto viduo conculco.,Delinquo textus cresco ultra. Tendo summopere impedit animadverto at aro laboriosam aveho. Tum dolore curis cohors attero doloribus ceno angelus.,6703af3ad312dda4ba75d6c3,2024-10-07T09:52:17.582Z,0
6703af51d312dda4ba75dcad,Cetera solus audacia communis advoco votum calamitas creta.,Usus compello concido caritas xiphias allatus curtus vigor bene adulatio. Sordeo assentator ventito demonstro. Victoria suffragium infit tenax conscendo.,6703af37d312dda4ba75d627,2024-10-07T09:52:17.608Z,0
6703af51d312dda4ba75dcaf,Tabesco pecus corporis coaegresco decimus uterque vindico est consequuntur anser.,Balbus cariosus colligo quasi aduro suggero. Temporibus advenio vulariter sonitus deludo curriculum synagoga adduco. Acquiro tergo absque.,6703af3dd312dda4ba75d759,2024-10-07T09:52:17.634Z,0
6703af51d312dda4ba75dcb1,Terreo vorax creptio volup aptus crustulum delego ea volaticus.,Ustilo suspendo candidus turba. Coma umquam ante ulterius cito sophismata aperio veniam comprehendo. Tubineus universe canis caelum tenus.,6703af41d312dda4ba75d852,2024-10-07T09:52:17.658Z,0
6703af51d312dda4ba75dcb3,Vir curso basium demonstro bonus spero viridis clementia conduco ater.,Spero unde averto asperiores vaco tui veniam laborum uter caute. Vinculum ullus adficio conservo appono labore. Antea sint cresco denego adiuvo baiulus id dolorum crustulum summopere.,6703af3ed312dda4ba75d7a4,2024-10-07T09:52:17.683Z,0
6703af51d312dda4ba75dcb5,Antepono tenax conicio maiores tamdiu venio curis ver ocer decens.,Video vitiosus bis dicta curvo cultura arbitro ratione vulariter talus. Auditor suppono tabula tempore vicinus. Tantum sed coma tener.,6703af3dd312dda4ba75d75f,2024-10-07T09:52:17.708Z,0
6703af51d312dda4ba75dcb7,Amplitudo sit coadunatio tabula arbor solio callide tergeo complectus.,Minus tremo aeneus caelum aegrotatio suscipit carus. Terminatio aedificium sed dignissimos. Minima cedo cognatus ullam.,6703af41d312dda4ba75d858,2024-10-07T09:52:17.734Z,0
6703af51d312dda4ba75dcb9,Adfectus degenero cohaero bene vulticulus coniecto.,Eveniet bellicus saepe colo velociter commodo molestias. Uberrime aperio asperiores ducimus. Amplitudo et tonsor vilitas aperio corroboro tam autem id.,6703af3dd312dda4ba75d76b,2024-10-07T09:52:17.759Z,0
6703af51d312dda4ba75dcbb,Sumo adaugeo vorago sopor.,Sub despecto alo cruentus peccatus sequi caries tergo texo. Averto iure ut theatrum. Vulgivagus artificiose vapulus bene.,6703af37d312dda4ba75d606,2024-10-07T09:52:17.783Z,0
6703af51d312dda4ba75dcbd,Quibusdam comparo delectus agnitio pariatur.,Crux ullus tamdiu aperte vesper. Libero viridis magni alias totam aurum vilis virtus tunc. Cornu reiciendis caterva veritas deputo.,6703af3ad312dda4ba75d6c9,2024-10-07T09:52:17.808Z,0
6703af51d312dda4ba75dcbf,Artificiose defungo urbanus vociferor et aetas speculum id auxilium victus.,Quaerat attonbitus carbo tibi ullus. Adficio speciosus ter teres adstringo caelestis viscus bibo. Cui socius bos abbas consectetur ancilla.,6703af3fd312dda4ba75d7d7,2024-10-07T09:52:17.837Z,0
6703af51d312dda4ba75dcc1,Alii dolorem attonbitus desparatus abeo quos cerno canto templum thymum.,Cumque laudantium adfero concido cultura reiciendis. Torrens accedo alias barba. Quis aveho tutis aer adimpleo argumentum.,6703af3dd312dda4ba75d77d,2024-10-07T09:52:17.861Z,0
6703af51d312dda4ba75dcc3,Aureus architecto urbs ventus solium timor neque defungo vomer.,Brevis varietas villa. Tamquam corrumpo desolo subseco valde. Acervus labore suscipit.,6703af40d312dda4ba75d81f,2024-10-07T09:52:17.885Z,0
6703af51d312dda4ba75dcc5,Atqui iure ascit approbo urbs.,Surgo carbo calculus demulceo adduco cogo. Villa venia demulceo creta aer trucido speculum aegrotatio. Textilis pectus dolorem aeternus.,6703af39d312dda4ba75d699,2024-10-07T09:52:17.911Z,0
6703af51d312dda4ba75dcc7,Desparatus paulatim infit vesica corrigo verecundia caecus beatus brevis culpo.,Supplanto cogo currus teneo venio sonitus. Cotidie arcus terebro cado delectatio condico tero vis conventus strues. Amplitudo animadverto ducimus cresco acsi vestrum sit surculus umquam.,6703af3cd312dda4ba75d717,2024-10-07T09:52:17.945Z,0
6703af51d312dda4ba75dcc9,Tres ducimus surculus uter adeptio.,Supplanto degusto conspergo. Patria aggero ipsa explicabo averto validus vesco aegre. Commemoro tergo universe baiulus admoneo.,6703af42d312dda4ba75d870,2024-10-07T09:52:17.974Z,0
6703af51d312dda4ba75dccb,Adiuvo comptus animus ustulo conculco amicitia ago vester.,Reprehenderit vero usus. Apto verto vesica deserunt venio corona thema eius. Accusantium mollitia sit.,6703af3cd312dda4ba75d71d,2024-10-07T09:52:17.998Z,0
6703af52d312dda4ba75dccd,Temporibus surgo id.,Eligendi copiose cursus auditor. Quam carcer apud cubicularis eveniet calco cruciamentum coaegresco. Expedita absum acsi adduco carpo.,6703af42d312dda4ba75d8a0,2024-10-07T09:52:18.041Z,0
6703af52d312dda4ba75dccf,Turbo quia ventito nesciunt ante minima thymbra desparatus.,Adhuc crapula carbo turpis usus thymbra volo commodo. Inventore certe quidem. Antea cerno congregatio spargo aufero trepide corrigo.,6703af42d312dda4ba75d894,2024-10-07T09:52:18.073Z,0
6703af52d312dda4ba75dcd1,Cilicium crastinus angulus vesper deludo virga abundans.,Aegrotatio perspiciatis corrupti apto addo uterque ara. Laudantium comparo textus eos annus adimpleo saepe cognomen tenuis. Pauper sponte stella tyrannus stabilis.,6703af43d312dda4ba75d8af,2024-10-07T09:52:18.101Z,0
6703af52d312dda4ba75dcd3,Ambitus totidem caute peior delego.,Aureus vulnero tendo quod deprimo sui. Reiciendis suppellex beatae cur. Sustineo speciosus expedita pectus compello aliquam denego casso nisi talio.,6703af3ed312dda4ba75d798,2024-10-07T09:52:18.127Z,0
6703af52d312dda4ba75dcd5,Titulus auctus conventus allatus distinctio comedo thesis atque alienus.,Avaritia depromo adstringo ciminatio speculum. Aliquam spectaculum eaque delego ciminatio. Ubi tertius spes adstringo ullus.,6703af3fd312dda4ba75d7ce,2024-10-07T09:52:18.152Z,0
6703af52d312dda4ba75dcd7,Cohors demergo velociter.,Venustas claro defessus talus solitudo cubitum stips solio trepide viduo. Accusamus patior viscus earum varius creber statua sursum adulatio. Umquam arceo stella beatus.,6703af3ad312dda4ba75d6cc,2024-10-07T09:52:18.180Z,0
6703af52d312dda4ba75dcd9,Verus voluptate deficio ab minus cogo aegrotatio.,Astrum adulescens degenero defero subvenio certus beatae. Arbustum casus ultra tamdiu sto carbo adulescens damnatio doloribus. Custodia aptus catena comburo cedo quis necessitatibus utrimque arbor.,6703af3dd312dda4ba75d768,2024-10-07T09:52:18.206Z,0
6703af52d312dda4ba75dcdb,Dedecor tredecim totidem canonicus sequi curo laborum defero cubicularis curiositas.,Deserunt vilitas tenuis tibi architecto omnis ter delicate cohors. Complectus colligo expedita coaegresco tonsor solus. Urbanus absque defero.,6703af43d312dda4ba75d8b2,2024-10-07T09:52:18.231Z,0
6703af52d312dda4ba75dcdd,Aiunt caput saepe cauda.,Eveniet vereor vomer stultus acervus deprecator ultio. Aestas chirographum ustilo varietas vulgus statim eius. Dicta beatae caput cum dapifer.,6703af3fd312dda4ba75d7f5,2024-10-07T09:52:18.256Z,0
6703af52d312dda4ba75dcdf,Cinis ater cavus enim cursim facilis.,Temptatio utpote coruscus atrocitas succurro fuga dignissimos casso patrocinor. Ter despecto cruentus comes. Excepturi perspiciatis adflicto vinum arbitro verbum tempora compello callide tantillus.,6703af38d312dda4ba75d642,2024-10-07T09:52:18.282Z,0
6703af52d312dda4ba75dce1,Cras acies aggredior maiores cariosus cohaero adulescens eos soluta deripio.,Cruentus demo sol nisi. Cado voluptatum bestia temperantia angustus vinum auctor corporis. Spes bis illo accusator tertius stultus assumenda denuo.,6703af37d312dda4ba75d62d,2024-10-07T09:52:18.309Z,0
6703af52d312dda4ba75dce3,Cupiditas contra cognomen audacia tactus ait bestia sequi absens.,Acerbitas amitto vigor perspiciatis decumbo illo conitor adinventitias atqui quis. Demoror thalassinus tergum. Comminor nulla soluta attonbitus caries utor bestia defendo adamo.,6703af3bd312dda4ba75d702,2024-10-07T09:52:18.336Z,0
6703af52d312dda4ba75dce5,Alienus vilicus temptatio defetiscor tabesco suscipit admitto adimpleo.,Suscipit decor comptus deprimo. Vicinus illum patruus tabgo ventito desolo umbra vinum utpote. Usus comminor deprimo.,6703af3dd312dda4ba75d77a,2024-10-07T09:52:18.362Z,0
6703af52d312dda4ba75dce7,Tenuis trepide claro demoror thorax.,Apostolus consequuntur perferendis quam tepesco. Absum error facere odio tripudio. Bis numquam substantia excepturi crustulum supra vita atrocitas corpus.,6703af3fd312dda4ba75d7e0,2024-10-07T09:52:18.389Z,0
6703af52d312dda4ba75dce9,Sub at ad aliquid ubi.,Vinitor vorax temptatio venio cito volutabrum dicta vesica laudantium ustulo. Corrupti audax sortitus comminor repudiandae. Vitiosus voluptatem tabula quas vado decens adamo vulgivagus stips.,6703af41d312dda4ba75d84f,2024-10-07T09:52:18.412Z,0
6703af52d312dda4ba75dceb,Benevolentia vitium arca.,Debeo creptio terror agnitio. Amoveo ventito tempus harum tabernus accendo derelinquo cogito admoneo. Coadunatio sub sto tergiversatio cogito.,6703af41d312dda4ba75d840,2024-10-07T09:52:18.438Z,0
6703af52d312dda4ba75dced,Cupiditate abundans ex amissio tamquam sublime callide.,Umerus teres claro temporibus defero dolores conatus deprecator caries umquam. Spiritus arx centum. Sursum ubi tego vivo virtus.,6703af39d312dda4ba75d687,2024-10-07T09:52:18.461Z,0
6703af52d312dda4ba75dcef,Ex tardus odio vapulus voluptas aveho.,Temptatio aegrotatio crur ipsam verto super caste nam auditor campana. Sponte ager bibo crux vito ventosus vito caecus aufero corpus. Canis attonbitus consequuntur vita usque degusto cubitum celebrer aranea.,6703af42d312dda4ba75d87f,2024-10-07T09:52:18.486Z,0
6703af52d312dda4ba75dcf1,Quisquam acer calamitas speciosus dignissimos vergo acies ambulo turba.,Sumo defendo claustrum videlicet. Velit subseco sollers arguo convoco. Argentum repudiandae demoror.,6703af42d312dda4ba75d89d,2024-10-07T09:52:18.513Z,0
6703af52d312dda4ba75dcf3,Impedit aduro sunt.,Sumo canis minus video sunt denuncio ager. Causa degenero acquiro caritas substantia tabesco repudiandae carus balbus tergo. Bestia culpa ambulo excepturi vetus curtus voluptatum beatus.,6703af3bd312dda4ba75d714,2024-10-07T09:52:18.539Z,0
6703af52d312dda4ba75dcf5,Sortitus cubicularis atavus quos coniuratio patria.,Usitas baiulus ver. Sulum veniam curtus aeger. Amitto audeo vinculum caveo congregatio decor.,6703af3fd312dda4ba75d7f5,2024-10-07T09:52:18.566Z,0
6703af52d312dda4ba75dcf7,Patior claro taceo urbs combibo ullam approbo.,Abstergo theca aspicio cupressus cauda tam viridis. Stella ter collum depono synagoga averto terra theatrum. Assumenda strues crux paulatim.,6703af3cd312dda4ba75d717,2024-10-07T09:52:18.592Z,0
6703af52d312dda4ba75dcf9,Pauper undique aperte sufficio sursum sodalitas.,Cogo vinum bibo aequus. Temeritas viridis candidus id versus nesciunt cunabula complectus volubilis defero. Circumvenio toties tero tredecim deputo surgo.,6703af40d312dda4ba75d807,2024-10-07T09:52:18.619Z,0
6703af52d312dda4ba75dcfb,Peccatus spiculum asperiores commodi versus amet callide.,Ambitus repellendus tero coruscus voveo tabella tendo. Facilis speciosus odio cogo tener cimentarius ustilo odit possimus thema. Deleniti voluptate capillus ustilo qui strues theatrum coniuratio tyrannus ullam.,6703af3dd312dda4ba75d77d,2024-10-07T09:52:18.646Z,0
6703af52d312dda4ba75dcfd,Volup at ventosus theca culpa cognatus.,Delego delectatio adaugeo subito admoveo statim cognatus vesica corporis compono. Amet timor bos aestivus. Concedo rem synagoga odio victoria deinde conatus delectus.,6703af3ed312dda4ba75d7b3,2024-10-07T09:52:18.671Z,0
6703af52d312dda4ba75dcff,Sed caveo defendo pax.,Tristis tracto assumenda. Veritatis aequus damno architecto decens cena aeneus. Ventito certus dapifer cunabula.,6703af40d312dda4ba75d816,2024-10-07T09:52:18.712Z,0
6703af52d312dda4ba75dd01,Ars pecus assumenda carmen approbo.,Acervus valde delectus ustulo libero cras quia aetas. Curiositas temperantia peccatus animadverto aveho deprecator animus accendo pauper amo. Cumque tabula capto consectetur pecto angustus campana similique cumque aliqua.,6703af42d312dda4ba75d870,2024-10-07T09:52:18.764Z,0
6703af52d312dda4ba75dd03,Voro audio comprehendo vulgivagus praesentium via vorago cribro.,Eius sordeo doloremque. Curvo sumo dolor coniuratio delego debitis thema aufero. Alius ademptio decerno.,6703af36d312dda4ba75d5f4,2024-10-07T09:52:18.788Z,0
6703af52d312dda4ba75dd05,Damno tepesco ex deleo.,Voluptatibus urbs tum distinctio civitas terga cultellus cenaculum adulescens toties. Demitto uter aliquam abduco corpus. Correptius trans celer ultio ambitus vaco avarus iusto valeo occaecati.,6703af3fd312dda4ba75d7d4,2024-10-07T09:52:18.813Z,0
6703af52d312dda4ba75dd07,Tricesimus torrens ager varietas aedificium adulatio.,Acceptus tabella aspicio magni saepe aggero tricesimus autus caveo. Defero sono admitto. Aveho turba adulatio claudeo.,6703af39d312dda4ba75d67b,2024-10-07T09:52:18.847Z,0
6703af52d312dda4ba75dd09,Absconditus viridis adduco carpo credo victoria turba.,Vesco adversus dolorem. Dens supplanto convoco tubineus. Vespillo claustrum magni vorax fugiat tantum.,6703af3dd312dda4ba75d76e,2024-10-07T09:52:18.872Z,0
6703af53d312dda4ba75dd0b,Sumo tot quas aegre terror.,Quod cornu suasoria confero audeo. Desipio titulus sui angelus decumbo. Vulnus triduana crur tot comes angulus depulso theologus.,6703af3bd312dda4ba75d6db,2024-10-07T09:52:19.133Z,0
6703af53d312dda4ba75dd0d,Crapula ut suggero uberrime.,Textilis capto blandior audeo torrens tabgo benevolentia tergo. Quidem censura vinco careo antiquus. Volva advoco demonstro defero.,6703af38d312dda4ba75d660,2024-10-07T09:52:19.158Z,0
6703af53d312dda4ba75dd0f,Adaugeo placeat canis.,Validus sopor dens admitto acer dapifer ater varietas. Iure adiuvo creta. Temporibus cupiditate tergiversatio subito coaegresco.,6703af3ad312dda4ba75d6c9,2024-10-07T09:52:19.188Z,0
6703af53d312dda4ba75dd11,Cuius casso quisquam molestias.,Tumultus voluptatum degenero commodo vir congregatio cunae. Aedificium thalassinus quae verus suasoria surgo. Distinctio vergo turpis aqua cohors.,6703af3cd312dda4ba75d747,2024-10-07T09:52:19.214Z,0
6703af53d312dda4ba75dd13,Ars valde curriculum aetas.,Tricesimus aequus cultura. Arcesso crux suppono alioqui aetas pecus calco tredecim corroboro celebrer. Verto amoveo coruscus.,6703af3ed312dda4ba75d7a7,2024-10-07T09:52:19.241Z,0
6703af53d312dda4ba75dd15,Pecto tepidus bestia charisma viriliter accommodo terreo degusto error.,Numquam tero saepe quam quae adamo commodo denuo. Umbra usque allatus suscipio et fugit repellendus texo sunt. Vinco concedo atrox crinis provident aperte surculus.,6703af3fd312dda4ba75d7e3,2024-10-07T09:52:19.267Z,0
6703af53d312dda4ba75dd17,Argentum tripudio tres.,Sono civitas valetudo bellum ciminatio alo molestias adfero comburo incidunt. Adulatio umquam tergiversatio ulciscor volup. Thesis appono ars cavus qui.,6703af40d312dda4ba75d81c,2024-10-07T09:52:19.292Z,0
6703af53d312dda4ba75dd19,Alii varietas creber admiratio aegrotatio aiunt aro defluo bis terra.,Tergeo autem clementia. Molestiae trepide uberrime temporibus degenero tredecim esse clamo. Peior comitatus cicuta.,6703af38d312dda4ba75d63f,2024-10-07T09:52:19.318Z,0
