_id,title,description,createdBy,createdAt,__v
6703af48d312dda4ba75da31,Cervus blandior combibo impedit vorax charisma attero deduco.,Cariosus conculco natus caritas despecto depraedor demum harum. Carpo degero argumentum ambulo aspernatur demonstro adstringo colo. Cribro despecto appono vindico illum deprecator patrocinor.,6703af3ad312dda4ba75d6ab,2024-10-07T09:52:08.570Z,0
6703af48d312dda4ba75da33,Bos cicuta caterva terminatio depromo autem amet circumvenio carmen.,Subito audacia vir molestiae dedico toties turbo aspernatur debeo cogo. Vestigium stella aveho cervus blanditiis tersus impedit repellendus. Capio patruus tergeo caries quod demonstro deporto paens.,6703af41d312dda4ba75d867,2024-10-07T09:52:08.603Z,0
6703af48d312dda4ba75da35,Vilitas coma cogo apud terra terminatio.,Tergeo defluo sui. Acer sunt sono acies. Delinquo claudeo turba amo apparatus deripio solium ventito versus.,6703af40d312dda4ba75d822,2024-10-07T09:52:08.628Z,0
6703af48d312dda4ba75da37,Conqueror tabgo adversus stultus versus accedo cornu.,Aegre ciminatio commodo vulgo adhuc aegre tristis. Alveus comminor voluptate. Atrocitas universe necessitatibus aegrotatio tripudio aliquam.,6703af3cd312dda4ba75d717,2024-10-07T09:52:08.653Z,0
6703af48d312dda4ba75da39,Cotidie cetera desipio decimus avarus.,Velum spectaculum spero volva. Magni abeo clementia abeo conqueror urbanus tibi vilis cito defero. Statim vulgivagus quasi comminor cornu virga beatus.,6703af38d312dda4ba75d639,2024-10-07T09:52:08.679Z,0
6703af48d312dda4ba75da3b,Praesentium auctus addo solus adduco non stipes.,Tutis creator cruentus temperantia absconditus vulpes vulariter abstergo autus. Censura subvenio tepidus validus optio perferendis volaticus consuasor callide. Voluptatum temeritas dapifer illum veritatis.,6703af3fd312dda4ba75d7c8,2024-10-07T09:52:08.704Z,0
6703af48d312dda4ba75da3d,Approbo sufficio decretum molestias amoveo temptatio appello tollo curto usitas.,Eveniet consuasor vulariter corpus auxilium maiores culpa bardus corrupti. Crur quis tenetur vetus tracto creptio usus damnatio arma. Adopto corrumpo stella.,6703af3bd312dda4ba75d6db,2024-10-07T09:52:08.729Z,0
6703af48d312dda4ba75da3f,Praesentium cena capio.,Libero dapifer valens alii utor venustas beatae. Vilitas arguo verbera. Toties cultellus tutis vito sequi termes.,6703af3dd312dda4ba75d74d,2024-10-07T09:52:08.754Z,0
6703af48d312dda4ba75da41,Solus velociter talus bellum vehemens.,Voluptates ullam auctor acerbitas aequitas socius deleniti defleo. Animus auctus accusator suppono ter tandem sub valens. Sint cultellus advenio curriculum.,6703af3dd312dda4ba75d77d,2024-10-07T09:52:08.777Z,0
6703af48d312dda4ba75da43,Dolor victus tamen tergeo.,Calco atqui eveniet error voluptates curia. Demum tyrannus cumque fugit tabgo. Velit minima dolor minus anser tibi accusantium.,6703af37d312dda4ba75d62d,2024-10-07T09:52:08.803Z,0
6703af48d312dda4ba75da45,Tergeo decimus similique texo approbo.,Testimonium speciosus vitium provident animus substantia acsi spes amaritudo. Vivo accommodo desipio. Tempus fugit uterque aeger laudantium suffoco decimus speciosus.,6703af39d312dda4ba75d67e,2024-10-07T09:52:08.830Z,0
6703af48d312dda4ba75da47,Callide benevolentia accendo pel appono cilicium usus arcesso virgo arto.,Antiquus capitulus angustus caste vilicus. Tandem umbra degenero reiciendis. Deinde compello deduco adeptio.,6703af38d312dda4ba75d65d,2024-10-07T09:52:08.856Z,0
6703af48d312dda4ba75da49,Astrum inflammatio minus dolores pauci confido deserunt volubilis totus.,Cuius amplexus bis versus tutamen amor crebro utrum alii. Curtus adopto illum canis beneficium adflicto viriliter. Animadverto debilito cur atrocitas.,6703af40d312dda4ba75d813,2024-10-07T09:52:08.882Z,0
6703af48d312dda4ba75da4b,Taedium tamen voco titulus.,Maxime toties crapula acer vivo auditor. Verbum apud advenio tandem cernuus. Adficio ipsa amor vilitas conor.,6703af3ad312dda4ba75d6c6,2024-10-07T09:52:08.907Z,0
6703af48d312dda4ba75da4d,Recusandae undique curia.,Viduo concedo excepturi solio pariatur tertius. Audentia eius ager cum aequitas urbs. Officia uberrime degero capto sulum articulus debilito umbra.,6703af39d312dda4ba75d66f,2024-10-07T09:52:08.931Z,0
6703af48d312dda4ba75da4f,Dolorum conduco deserunt umerus adulescens depereo.,Attollo animadverto desipio. Aut debitis vomer sol sulum. Neque bonus deludo sulum desidero collum repellendus synagoga terga.,6703af3ed312dda4ba75d79b,2024-10-07T09:52:08.957Z,0
6703af48d312dda4ba75da51,Aer deripio sufficio venustas barba.,Demum sponte nihil deorsum sum cuius fuga supplanto. Circumvenio voluptate certus comis. Acies casso adulescens sulum vetus qui ullam.,6703af3cd312dda4ba75d744,2024-10-07T09:52:08.983Z,0
6703af49d312dda4ba75da53,Cunctatio molestias amor conspergo cavus denuncio aequitas supra doloribus.,Teneo confido ullam basium circumvenio ullam aiunt sodalitas subiungo. Volup vinculum ratione tepidus. Artificiose suggero ciminatio vulgaris suffoco damno varius stipes benigne.,6703af3ad312dda4ba75d6cc,2024-10-07T09:52:09.006Z,0
6703af49d312dda4ba75da55,Tabella triduana celebrer.,Exercitationem subvenio apostolus rem. Absque deficio stella territo tracto curis harum confido libero vesper. Iure tremo abscido addo auctor tristis volaticus vox sumptus.,6703af3bd312dda4ba75d6f3,2024-10-07T09:52:09.029Z,0
6703af49d312dda4ba75da57,Conventus artificiose denego quis damnatio.,Sollicito vulgivagus utpote ver. Tepesco subiungo talus angustus approbo voluptate bardus demum alter antea. Suus desipio corrigo vester consuasor turbo vere.,6703af37d312dda4ba75d624,2024-10-07T09:52:09.055Z,0
6703af49d312dda4ba75da59,Deserunt suggero vivo.,Tabella totam approbo ascit sum turpis. Undique dedico suggero desidero admoveo neque cogito tandem altus apto. Civitas libero aeger antiquus.,6703af37d312dda4ba75d5f7,2024-10-07T09:52:09.081Z,0
6703af49d312dda4ba75da5b,Tandem aequitas talio amor carbo depraedor deporto conscendo summisse voluptatibus.,Sequi voco strues consequuntur titulus pecco. Decipio perferendis apparatus nulla velum voluptatum molestiae absque. Anser nesciunt facilis textus centum colligo vulgaris dedico curriculum.,6703af40d312dda4ba75d828,2024-10-07T09:52:09.105Z,0
6703af49d312dda4ba75da5d,Itaque verus voro creta aufero depereo verecundia error.,Tutis supellex casso tenuis patria abduco pel uberrime triduana spero. Suffoco reiciendis denuncio conduco admiratio. Placeat triduana despecto spoliatio adaugeo.,6703af37d312dda4ba75d603,2024-10-07T09:52:09.131Z,0
6703af49d312dda4ba75da5f,Abeo conventus congregatio vespillo calamitas considero canonicus textilis trans absum.,Callide cenaculum vesica tactus conor collum turbo adinventitias. Aurum tempora vel vel ustulo utrimque defero xiphias vulticulus denuo. Adopto maxime tabesco.,6703af3ad312dda4ba75d6cf,2024-10-07T09:52:09.157Z,0
6703af49d312dda4ba75da61,Arca tener eos crinis una.,Utor xiphias terminatio. Urbanus crudelis autem cito utroque sapiente adhaero aggero. Constans terminatio virgo conqueror cornu ut audacia auctus.,6703af37d312dda4ba75d5fa,2024-10-07T09:52:09.184Z,0
6703af49d312dda4ba75da63,Versus unus tabesco clamo autus attero suus soluta.,Contabesco ut voluptatem suasoria video averto consequatur conscendo civitas. Appono abundans una. Bardus stipes studio ago aliquid cattus caries sto.,6703af3bd312dda4ba75d6ff,2024-10-07T09:52:09.210Z,0
6703af49d312dda4ba75da65,Arguo patior valens quaerat adfectus tondeo tum.,Hic modi antiquus temporibus commemoro decor tantum. Video accusamus decretum virgo copia atrocitas caput similique. Attollo temporibus verumtamen.,6703af38d312dda4ba75d63f,2024-10-07T09:52:09.237Z,0
6703af49d312dda4ba75da67,Umbra vito utrimque aegrus stillicidium conscendo canonicus decet.,Unus reiciendis aliqua versus ait vita aestus attero depulso. Corrumpo spes barba. Summa vivo cauda decipio.,6703af38d312dda4ba75d630,2024-10-07T09:52:09.264Z,0
6703af49d312dda4ba75da69,Ambulo caelum validus decumbo abundans decor.,Antea ciminatio laudantium ullus capillus acerbitas. Vestigium statua vinculum aro. Sumptus crepusculum decor asporto adulescens vilitas.,6703af37d312dda4ba75d61e,2024-10-07T09:52:09.289Z,0
6703af49d312dda4ba75da6b,Congregatio audentia damno bardus succedo.,Truculenter vivo vespillo creber tersus nesciunt teres somniculosus. Infit callide suffragium cubo beatae. Vestrum casus cimentarius.,6703af38d312dda4ba75d633,2024-10-07T09:52:09.312Z,0
6703af49d312dda4ba75da6d,Coruscus aveho demoror ager fuga.,Canto territo pecco aequus. Occaecati certus casso urbanus addo voluptatem. Concedo vado aedificium damnatio arma tactus.,6703af40d312dda4ba75d81c,2024-10-07T09:52:09.335Z,0
6703af49d312dda4ba75da6f,Dapifer paens conqueror caveo crebro pecus.,Vita concido absque cumque vinitor spero ultio uter acsi aeternus. Pax caelestis dedico qui cotidie. Cimentarius vinculum armarium temporibus administratio recusandae verumtamen.,6703af3cd312dda4ba75d732,2024-10-07T09:52:09.358Z,0
6703af49d312dda4ba75da71,Blandior anser debitis confugo nam culpa nesciunt toties.,Suscipit addo bos. Cilicium attero crepusculum ait. Tunc cinis bestia totam arguo aut templum.,6703af42d312dda4ba75d870,2024-10-07T09:52:09.381Z,0
6703af49d312dda4ba75da73,Adimpleo velociter decerno verus appello socius quod.,Derelinquo stips pax consuasor necessitatibus uredo copia vicinus aliqua voluptate. Alter debitis villa absque voluptate. Vester in aliquam subiungo succedo cras.,6703af37d312dda4ba75d603,2024-10-07T09:52:09.405Z,0
6703af49d312dda4ba75da75,Vitae dolor ancilla ars virtus.,Chirographum vos sodalitas uter asper ait tenetur. Somnus comminor certus ars. Infit commodo viriliter tenax adfero arguo.,6703af3ad312dda4ba75d6b4,2024-10-07T09:52:09.429Z,0
6703af49d312dda4ba75da77,Ad aspernatur spiculum quo spoliatio.,Demonstro magnam ex attonbitus. Cibus sono vinco absorbeo conscendo accusamus somnus. Tutamen defleo copiose usque adversus arca adinventitias.,6703af42d312dda4ba75d8a9,2024-10-07T09:52:09.455Z,0
6703af49d312dda4ba75da79,Curo caecus quibusdam ipsum damno demergo.,Sortitus aggredior basium. Sollicito esse abutor arbustum. Amet iste talis dolores defero commodi debitis creptio trepide.,6703af38d312dda4ba75d657,2024-10-07T09:52:09.480Z,0
6703af49d312dda4ba75da7b,Voluptates ut autus callide bonus.,Ars ars decens delibero peior. Caste deripio spes. Sordeo illum socius adfectus solium aperte suscipio facere.,6703af3fd312dda4ba75d7e6,2024-10-07T09:52:09.504Z,0
6703af49d312dda4ba75da7d,Cultellus argumentum infit strenuus nam suus taceo suscipit.,Verecundia hic agnitio attollo anser. Acerbitas cilicium vulnero cunabula stabilis derideo neque. Corrupti defessus delectus cotidie cilicium tribuo.,6703af3fd312dda4ba75d7e0,2024-10-07T09:52:09.529Z,0
6703af49d312dda4ba75da7f,Defendo argumentum accusantium volo cultellus sustineo.,Vinculum ratione suffoco tracto defleo vapulus cunae. Strenuus strues paens curia. In triduana thesis.,6703af3cd312dda4ba75d73b,2024-10-07T09:52:09.555Z,0
6703af49d312dda4ba75da81,Denuo cura traho accusantium.,Uter mollitia catena amicitia vix utilis vomica provident confero constans. Deleo cruciamentum fugit. Teneo contigo perspiciatis soleo titulus confero iste circumvenio bene considero.,6703af3dd312dda4ba75d75c,2024-10-07T09:52:09.581Z,0
6703af49d312dda4ba75da83,Expedita desidero demoror atque blanditiis architecto ab placeat animus vereor.,Fugit censura deleo vilicus ratione caecus denique campana amor. Deporto tui annus. Acies aureus crebro ager.,6703af39d312dda4ba75d690,2024-10-07T09:52:09.604Z,0
6703af49d312dda4ba75da85,Venio tunc ventosus sunt tabgo ocer demo reiciendis coaegresco.,Vulticulus correptius minus claudeo adfectus. Dedecor virgo totidem ut. Calculus virga taceo ipsum arbor degero cunabula suggero.,6703af3dd312dda4ba75d76b,2024-10-07T09:52:09.630Z,0
6703af49d312dda4ba75da87,Necessitatibus terreo colligo cras talis.,Celer vix pel cibus agnitio maxime subnecto aggero. Decens crapula caveo conqueror cohibeo. Carus crapula degusto.,6703af43d312dda4ba75d8af,2024-10-07T09:52:09.657Z,0
6703af49d312dda4ba75da89,Molestiae uterque cupressus tenus administratio considero apud ipsam aggredior surgo.,Demonstro quae calcar derideo sollicito aurum. Calamitas doloremque cicuta teres doloribus sordeo volubilis conforto acsi. Avaritia vivo abeo artificiose.,6703af3ed312dda4ba75d7a7,2024-10-07T09:52:09.682Z,0
6703af49d312dda4ba75da8b,Abeo adiuvo administratio tardus corporis ullam occaecati articulus.,Animadverto harum delectatio supellex ceno cursim tepidus apparatus nesciunt. Conservo sortitus placeat dapifer taedium voro beatae. Comburo vallum ut ciminatio subseco voveo decipio demonstro stillicidium porro.,6703af3ad312dda4ba75d6d2,2024-10-07T09:52:09.708Z,0
6703af49d312dda4ba75da8d,Volo arceo civitas deleniti vester aperte via cotidie utilis.,Vallum patior nulla tracto. Adduco tollo atque speciosus tempora cognomen pauci adflicto volup. Adopto adaugeo urbanus trepide viriliter tenus somniculosus.,6703af37d312dda4ba75d627,2024-10-07T09:52:09.735Z,0
6703af49d312dda4ba75da8f,Conicio quidem deleniti supra derideo.,Dicta comes culpo eius vilitas stella. Iure laborum tolero depopulo conor despecto minus convoco coerceo conitor. Vulgivagus deprimo rerum.,6703af43d312dda4ba75d8b8,2024-10-07T09:52:09.760Z,0
6703af49d312dda4ba75da91,Utrimque autus reprehenderit volva aestas suffoco.,Iusto fugit conventus decerno amo quis verto demergo damnatio. Sordeo appositus congregatio. Sto adfectus peior soluta.,6703af41d312dda4ba75d84c,2024-10-07T09:52:09.784Z,0
6703af49d312dda4ba75da93,Tertius asporto degenero sophismata depono substantia bibo unde comparo.,Considero porro socius. Vapulus architecto excepturi antiquus surgo. Creator atqui uter decretum quibusdam.,6703af3bd312dda4ba75d6f3,2024-10-07T09:52:09.809Z,0
6703af49d312dda4ba75da95,Vado somnus pecto magnam arcesso decipio texo.,Praesentium summa cruentus aufero aperio synagoga amissio eveniet. Vulticulus auxilium civitas aestas tamdiu socius cuppedia cinis amplexus dedecor. Victoria adicio talio nisi voluptates carus arbor tamdiu.,6703af3bd312dda4ba75d6ed,2024-10-07T09:52:09.836Z,0
6703af49d312dda4ba75da97,Illum soleo cubitum vilitas.,Thema aegrotatio temporibus. Audio vilitas aegrotatio cibo spiritus. Agnitio defetiscor tamdiu.,6703af38d312dda4ba75d636,2024-10-07T09:52:09.861Z,0
6703af49d312dda4ba75da99,Vilitas cena tabesco benigne vobis tenus subito vergo minus vinco.,Bellicus ascisco stabilis deporto itaque. Amitto temporibus amplus vos sortitus admoveo apostolus verus arbitro. Stabilis vae terebro aeternus pariatur umquam deorsum.,6703af41d312dda4ba75d867,2024-10-07T09:52:09.885Z,0
6703af49d312dda4ba75da9b,Comminor vulticulus arcesso umquam perspiciatis vaco amplitudo apud.,Verus supellex uredo torrens volubilis tres culpo voluptas. Cilicium vox vulgo decumbo illo decipio arcus occaecati. Conitor celer cunctatio aestas volo.,6703af38d312dda4ba75d660,2024-10-07T09:52:09.910Z,0
6703af49d312dda4ba75da9d,Quod amoveo sol sulum ratione.,Sophismata volo theologus. Labore verecundia trado adsuesco soleo caelestis contego ustulo. Magnam possimus cupiditas creator absconditus unde dedecor tendo.,6703af3cd312dda4ba75d741,2024-10-07T09:52:09.937Z,0
6703af49d312dda4ba75da9f,Doloremque ad voluptatibus hic tunc apud.,Approbo demulceo titulus caries voveo clam. Vulariter vigor alveus audacia demoror cupiditate. Abundans defessus non curto cupiditate vita patruus cedo sub.,6703af42d312dda4ba75d876,2024-10-07T09:52:09.961Z,0
6703af49d312dda4ba75daa1,Vitium texo sumptus subiungo spes vitium.,Sulum cupio vivo. Confugo confero solutio tenus confugo sub tametsi. Apostolus sint nulla.,6703af3ed312dda4ba75d7b3,2024-10-07T09:52:09.984Z,0
6703af4ad312dda4ba75daa3,Rem turpis curis arto adimpleo conservo.,Accedo cauda laudantium deserunt via aqua arbustum laborum esse. Conicio censura vae vereor vos adflicto voluptatum angustus tergum summa. Ulciscor incidunt ara amita demergo.,6703af3ad312dda4ba75d6d2,2024-10-07T09:52:10.008Z,0
6703af4ad312dda4ba75daa5,Ago fuga venustas canto id.,Animi cometes ab vociferor attonbitus agnitio vociferor claudeo. Vesper degero pariatur verus adduco. Curriculum officiis animadverto molestias demonstro admoneo.,6703af3fd312dda4ba75d7ec,2024-10-07T09:52:10.273Z,0
6703af4ad312dda4ba75daa7,Conicio ad sto.,Solio bonus nemo subseco vinum. Custodia adsum enim appello tenetur appello. Strenuus pecto vere tutamen usitas denego crux.,6703af3bd312dda4ba75d6fc,2024-10-07T09:52:10.300Z,0
6703af4ad312dda4ba75daa9,Tracto viduo usus strenuus calamitas timidus tam quos dens.,Colligo textus tenetur administratio averto blandior. Arma vomer abstergo usque velit vicissitudo tunc coepi tamisium. Surgo contigo pectus officia defungo trepide cado tabella custodia tabgo.,6703af3fd312dda4ba75d7d4,2024-10-07T09:52:10.327Z,0
6703af4ad312dda4ba75daab,Abeo vir vereor tabula.,Aestivus tabgo tabula condico sumptus temeritas abutor astrum timor appono. Universe ratione appono defaeco verumtamen minus vilicus. Saepe vere supellex.,6703af40d312dda4ba75d82e,2024-10-07T09:52:10.352Z,0
6703af4ad312dda4ba75daad,Conspergo truculenter ratione confero circumvenio triumphus.,Temeritas appositus cribro velociter spero aspicio. Ciminatio sapiente careo culpa atavus. Tumultus tondeo autem terror vinco aranea adipisci volo convoco.,6703af42d312dda4ba75d87f,2024-10-07T09:52:10.375Z,0
6703af4ad312dda4ba75daaf,Carus appello video adulescens verbum voluptatem.,Amiculum aestas trepide adeptio turba repudiandae subnecto. Casso vestigium praesentium vestigium absorbeo. Usus vulgivagus commemoro arcus brevis denique temporibus.,6703af41d312dda4ba75d83a,2024-10-07T09:52:10.400Z,0
6703af4ad312dda4ba75dab1,Audax praesentium tabgo conicio baiulus via umerus pectus delectus taceo.,Officiis centum clibanus volo. Ipsum cultellus via patria consequatur arca velociter adopto cunae. Xiphias terreo iusto aranea ventosus teneo atque tandem.,6703af3fd312dda4ba75d7e0,2024-10-07T09:52:10.428Z,0
6703af4ad312dda4ba75dab3,Esse utilis urbanus denique placeat calamitas stella super culpa aut.,Tripudio custodia distinctio concedo asper crastinus commodi thesaurus. Concido aer minima delectus. Calamitas solum conor.,6703af40d312dda4ba75d801,2024-10-07T09:52:10.453Z,0
6703af4ad312dda4ba75dab5,Capto cogito causa advenio tepesco ventosus.,Cras sunt ante eveniet aufero. Auxilium catena vestigium bellicus deleo stella. Texo caries stipes sulum depromo thesaurus vox decerno.,6703af3fd312dda4ba75d7d4,2024-10-07T09:52:10.477Z,0
6703af4ad312dda4ba75dab7,Somnus amicitia tabesco arguo circumvenio illo demoror.,Taedium sustineo voluptatibus earum thesaurus. Vulgo autus vesper clarus creo. Aeternus nobis sordeo itaque ait valeo summa.,6703af3cd312dda4ba75d717,2024-10-07T09:52:10.507Z,0
6703af4ad312dda4ba75dab9,Stips ver ascisco articulus terminatio auctus.,Tametsi voveo tamen amo vix adsidue sodalitas volubilis. Aliquam tum urbanus terebro aliqua iusto cunctatio correptius utrimque. Atqui cupressus sub currus sperno pectus quis.,6703af43d312dda4ba75d8b5,2024-10-07T09:52:10.532Z,0
6703af4ad312dda4ba75dabb,Peccatus versus deporto hic absconditus timor super delego amiculum.,Assentator cohibeo quis officia surculus talus somnus ventito catena. Confido depereo super confugo curiositas congregatio brevis ex corrupti. Eos suffragium iusto cura pax delectatio clementia adsidue vallum tam.,6703af3bd312dda4ba75d6e1,2024-10-07T09:52:10.555Z,0
6703af4ad312dda4ba75dabd,Aestivus tutis sopor recusandae quidem doloremque.,Sublime beneficium repellat. Atqui terga curiositas color vulpes vallum dapifer cedo cibus tero. Inventore civis studio debeo adicio civis trans derelinquo soluta coniecto.,6703af3cd312dda4ba75d726,2024-10-07T09:52:10.579Z,0
6703af4ad312dda4ba75dabf,Ceno dedico harum canto tego antiquus adfectus conturbo aveho.,Certe contigo vicissitudo armarium ascit ullam animus copia adfectus. Vilitas tollo aspicio custodia fuga sto cum terreo. Soleo sint cresco aptus vesica.,6703af39d312dda4ba75d68a,2024-10-07T09:52:10.604Z,0
6703af4ad312dda4ba75dac1,Bestia rerum earum.,Subvenio contabesco via distinctio aggero magni. Quibusdam vorago cultellus virtus veritas. Eveniet voco cupio rem vicissitudo cum curvo caput ulciscor.,6703af3cd312dda4ba75d73b,2024-10-07T09:52:10.631Z,0
6703af4ad312dda4ba75dac3,Sopor territo caelestis despecto atrocitas audentia odit.,Testimonium curtus pectus benevolentia texo cursus usitas. Admoneo consequatur tonsor admoveo velit rerum victus. Territo desino accommodo circumvenio tamisium umbra capio vapulus vinco culpo.,6703af37d312dda4ba75d618,2024-10-07T09:52:10.657Z,0
6703af4ad312dda4ba75dac5,Arceo aperte barba tabesco.,Harum degenero solutio incidunt patior terror sed. Considero demoror demergo porro voro atrox. Derelinquo desidero cerno pariatur caput vita.,6703af3dd312dda4ba75d762,2024-10-07T09:52:10.683Z,0
6703af4ad312dda4ba75dac7,Supplanto comptus culpo.,Cicuta ullam officiis sapiente. Argentum talis synagoga vestigium adduco triumphus deludo spes. Sed solum sint spoliatio cotidie ante universe verbum tertius ademptio.,6703af38d312dda4ba75d645,2024-10-07T09:52:10.708Z,0
6703af4ad312dda4ba75dac9,Suus virgo atque barba compono sol.,Tamdiu aetas verbum. Una pectus cattus videlicet strues tendo terror. Ducimus audeo brevis super accusator quasi suasoria abstergo sapiente decretum.,6703af37d312dda4ba75d612,2024-10-07T09:52:10.734Z,0
6703af4ad312dda4ba75dacb,Caelestis audeo apparatus undique deserunt.,Accendo artificiose thesaurus absorbeo vociferor arguo amissio speculum sum. Aeternus sonitus vilitas sumo sumptus dignissimos. Crustulum pax utrum harum versus creptio aperte omnis sto suffoco.,6703af37d312dda4ba75d618,2024-10-07T09:52:10.759Z,0
6703af4ad312dda4ba75dacd,Adicio usque cultellus allatus cras tres labore dolorum spiculum voluntarius.,Sopor arbitro patrocinor umquam illo defaeco. Argentum omnis cursim statim aperte laborum laboriosam carcer. Deserunt rem cribro.,6703af3ed312dda4ba75d792,2024-10-07T09:52:10.783Z,0
6703af4ad312dda4ba75dacf,Decimus absque aptus synagoga.,Toties perspiciatis perspiciatis. Pecco ustilo strenuus tolero excepturi succedo animi. Ater possimus crapula truculenter alioqui.,6703af3cd312dda4ba75d74a,2024-10-07T09:52:10.807Z,0
6703af4ad312dda4ba75dad1,Templum appono surculus illo conservo.,Adsidue cernuus adficio. Pauper sonitus adsum quia vigilo alius. Absconditus charisma complectus curriculum vestrum peccatus desino adfero.,6703af3ed312dda4ba75d7b3,2024-10-07T09:52:10.832Z,0
6703af4ad312dda4ba75dad3,Sophismata arceo atavus aranea timor torqueo.,Speciosus delectus crux cimentarius magnam verecundia. Repellendus iusto adfectus. Aspicio omnis similique correptius tertius eius virgo.,6703af3bd312dda4ba75d6f6,2024-10-07T09:52:10.858Z,0
6703af4ad312dda4ba75dad5,Ago tabernus aestus libero tero deprecator aestas viriliter varius ducimus.,Caput ad rem laudantium carus pecto totam crur benevolentia viriliter. Corroboro cervus dens adfero conor. Et vereor uberrime censura summisse conspergo spes non umquam comminor.,6703af42d312dda4ba75d89a,2024-10-07T09:52:10.883Z,0
6703af4ad312dda4ba75dad7,Talio cuius vigor error decerno cum subnecto aveho ustilo.,Vulgaris torqueo accusantium suffragium copiose. Vilis nobis cubicularis apparatus aeneus minus recusandae vomito repellendus. Aliquam calcar magni.,6703af37d312dda4ba75d5f7,2024-10-07T09:52:10.909Z,0
6703af4ad312dda4ba75dad9,Vorago talus consuasor cimentarius aegrotatio.,Credo audacia abstergo cinis comparo terebro coadunatio. Teres umquam conqueror crastinus defetiscor tyrannus textus. Suadeo demonstro conforto villa vehemens adiuvo.,6703af40d312dda4ba75d810,2024-10-07T09:52:10.936Z,0
6703af4ad312dda4ba75dadb,Alii carmen comprehendo alveus esse apparatus coaegresco.,Uter ambitus apto colo comburo vinum subnecto crastinus vulgus. Curia conservo pecco defendo velut cur amplitudo. Ipsam uxor adfero viriliter pecus.,6703af3bd312dda4ba75d6ed,2024-10-07T09:52:10.961Z,0
6703af4ad312dda4ba75dadd,Agnosco cohibeo praesentium aureus clarus tolero aestivus tabella.,Adhuc absorbeo bardus volva valetudo auctor. Ver aegrotatio vergo adulatio minus vitae tantillus caecus civis copiose. Colligo corporis artificiose thorax conor adulatio.,6703af3bd312dda4ba75d6ea,2024-10-07T09:52:10.987Z,0
6703af4bd312dda4ba75dadf,Perspiciatis tabgo antea aiunt argumentum quaerat altus volva.,Valde atque defessus basium voluptatum benevolentia pecto. Aperte clam totam somnus caelestis cibo. Blandior barba arx caelum dolorem cornu sollicito.,6703af3dd312dda4ba75d780,2024-10-07T09:52:11.012Z,0
6703af4bd312dda4ba75dae1,Theologus teneo deleniti tepesco.,Laborum complectus aegrotatio sto aspernatur comes aestivus aer. Aegrus delinquo suasoria error appositus. Uter perferendis adfectus despecto vir.,6703af3ed312dda4ba75d7aa,2024-10-07T09:52:11.039Z,0
6703af4bd312dda4ba75dae3,Addo confido uterque temeritas eveniet arx caput despecto.,Dignissimos utrum canis canis viscus termes aggredior defessus valde. Error civitas creta casso reprehenderit. Facere thermae villa.,6703af38d312dda4ba75d63f,2024-10-07T09:52:11.066Z,0
6703af4bd312dda4ba75dae5,Comprehendo corona aperio comparo apostolus adulescens.,Cetera atqui spiritus thorax adsuesco demo currus coaegresco crinis. Ratione abstergo aetas voluptatem viduo paens. Circumvenio cras candidus argentum delibero vicissitudo creptio subnecto.,6703af38d312dda4ba75d64b,2024-10-07T09:52:11.090Z,0
6703af4bd312dda4ba75dae7,Vir degusto subiungo tandem spiritus derideo eum capio calco terra.,Acsi cultura velut succurro vulnero crudelis cauda. Angustus voluptate attonbitus ver conatus comis caries alioqui creptio. Vorax laborum supplanto damno ventus demoror sordeo degenero quibusdam.,6703af41d312dda4ba75d86a,2024-10-07T09:52:11.114Z,0
6703af4bd312dda4ba75dae9,Consequuntur alveus damno adsidue.,Claro alii compono quidem colligo possimus cultellus virtus ademptio nulla. Voluptatum quo repellat candidus sollers vesco cogito. Aurum adnuo defero explicabo corrigo venia via.,6703af41d312dda4ba75d867,2024-10-07T09:52:11.140Z,0
