_id,title,description,createdBy,createdAt,__v
6703af58d312dda4ba75de95,Bellum creptio temporibus quod bonus.,Est considero deleniti templum caelum spectaculum tibi denego admoveo. Xiphias maxime maxime vaco cimentarius vilitas temptatio nesciunt argentum ustilo. Vapulus suppono quia degusto cedo accusamus auxilium.,6703af41d312dda4ba75d83d,2024-10-07T09:52:24.115Z,0
6703af58d312dda4ba75de97,Tener expedita tamquam curtus.,Aestivus corroboro facilis magni ter pecco quam utroque. Nihil dapifer dicta argumentum eveniet sustineo explicabo vulariter inventore. Bos quae accedo ventito vulpes thema sophismata contigo abutor blandior.,6703af38d312dda4ba75d651,2024-10-07T09:52:24.142Z,0
6703af58d312dda4ba75de99,Taceo collum corona apud vitiosus degero.,Calco tondeo vado cervus maiores denego somnus voluptatibus. Ventosus animadverto ante dolorum. Attonbitus cohaero apto verumtamen.,6703af3ed312dda4ba75d7a4,2024-10-07T09:52:24.167Z,0
6703af58d312dda4ba75de9b,Truculenter cattus communis illo carmen coma angulus curiositas.,Viscus articulus venia uxor verecundia aestivus speciosus crepusculum quam. Defleo curia verbum ab cernuus sed cena. Tunc tamquam quidem subvenio somnus.,6703af3bd312dda4ba75d6fc,2024-10-07T09:52:24.194Z,0
6703af58d312dda4ba75de9d,Circumvenio utilis arbor pauci titulus angulus aeternus velum depereo.,Coruscus coaegresco trans uterque enim cohaero doloribus vetus admoneo. Totidem comes quibusdam demo eligendi vulariter. Una provident caelestis suffoco soluta amiculum voluptatem summopere auxilium tredecim.,6703af3fd312dda4ba75d7f5,2024-10-07T09:52:24.220Z,0
6703af58d312dda4ba75de9f,Nihil voluptate porro sollicito timidus adhaero absque.,Theologus desolo audacia stabilis utroque conduco. Tutis annus adinventitias valde aurum ambitus patior fugit subiungo. Spoliatio demoror comis sufficio tolero adaugeo curiositas.,6703af3bd312dda4ba75d6de,2024-10-07T09:52:24.245Z,0
6703af58d312dda4ba75dea1,Speculum aestas deleo desidero.,Adficio acidus argentum suffragium vulgo basium auctor vomer cotidie. Arca recusandae quis dolore adsuesco cogito vigilo paulatim correptius. Conitor velociter cubo.,6703af3dd312dda4ba75d750,2024-10-07T09:52:24.271Z,0
6703af58d312dda4ba75dea3,Viduo abstergo delectatio compono atavus tenetur viscus canonicus vorago.,Audio arca sollicito. Coaegresco somnus titulus adficio. Tergiversatio defungo carmen delicate comedo.,6703af3cd312dda4ba75d738,2024-10-07T09:52:24.298Z,0
6703af58d312dda4ba75dea5,Apud deludo volo.,Depereo cultura attonbitus approbo colo arcesso ocer decimus vilitas stella. Totus amplus consuasor aliquam aggero color. Subnecto tenus adimpleo caries degusto terror damno celebrer.,6703af3cd312dda4ba75d723,2024-10-07T09:52:24.323Z,0
6703af58d312dda4ba75dea7,Voluptate vulgaris sponte.,Cultellus comedo vestrum usitas ancilla canonicus thalassinus. Defluo trucido trans unus voluptates utrimque esse. Tamdiu tutamen temeritas.,6703af36d312dda4ba75d5eb,2024-10-07T09:52:24.348Z,0
6703af58d312dda4ba75dea9,Amo bellum beneficium absorbeo corrupti architecto.,Cohors sub brevis communis conatus sequi veritatis ab. Alias tres cur credo. Deripio combibo cui totidem vis abbas velit volubilis.,6703af3cd312dda4ba75d732,2024-10-07T09:52:24.375Z,0
6703af58d312dda4ba75deab,Arma accusamus et benevolentia sui vestigium unus spes.,Amitto tolero teres via solium thema curto. Patria verto claudeo admoveo decet capto cibo consequatur via. Comburo sustineo sunt titulus ocer aestus aiunt aestas.,6703af3fd312dda4ba75d7ce,2024-10-07T09:52:24.401Z,0
6703af58d312dda4ba75dead,Fugiat teres temporibus turbo crinis excepturi adopto aestus.,Trans cresco decens vetus sui supra aliquid. Vorax paens cognomen votum contabesco. Curo neque utique apud adeo victus avarus speciosus coniecto pecco.,6703af3bd312dda4ba75d714,2024-10-07T09:52:24.426Z,0
6703af58d312dda4ba75deaf,Una aspicio adinventitias atrocitas arto subnecto arbitro odit corroboro.,Qui caste tempus vacuus allatus peccatus basium vitium vester. Terror adduco demum sublime tametsi. Cibus apostolus ager.,6703af3bd312dda4ba75d705,2024-10-07T09:52:24.452Z,0
6703af58d312dda4ba75deb1,Excepturi vorago argumentum verbum combibo quos utpote corporis cervus.,Conicio debilito conturbo universe vis viridis voro somnus utilis. Arbitro virgo vivo defaeco perspiciatis comparo validus tenus. Placeat depromo verus tergeo deleo abstergo patria.,6703af3bd312dda4ba75d6de,2024-10-07T09:52:24.478Z,0
6703af58d312dda4ba75deb3,Cogo cupiditate abbas conscendo solium.,Totidem voluptatum repellat vix barba complectus crustulum vero avaritia. Casus nihil cogito clementia vesco adamo coma tenetur sed tremo. Adipiscor sodalitas degenero convoco.,6703af43d312dda4ba75d8af,2024-10-07T09:52:24.504Z,0
6703af58d312dda4ba75deb5,Damno canis paens cruentus ascisco sperno similique suspendo solio auctus.,Bibo demitto adulescens tam capio porro peior ara studio. Cavus conculco tenuis tam vesica doloremque canis ubi. Degenero sumo somniculosus surgo tempus viscus.,6703af38d312dda4ba75d64b,2024-10-07T09:52:24.529Z,0
6703af58d312dda4ba75deb7,Cauda nemo venustas somniculosus depopulo.,Depopulo campana pauci sub tutamen. Terror voco solitudo usus incidunt video sponte sui defero. Neque accusamus decerno credo votum atque.,6703af3cd312dda4ba75d729,2024-10-07T09:52:24.554Z,0
6703af58d312dda4ba75deb9,Viridis aperte stillicidium consuasor ex pecto deprecator.,Thermae altus infit admiratio cohors viduo carpo. Comedo sustineo absum suffragium tener vita dignissimos quibusdam caelestis abundans. Argumentum aptus cunabula dedecor iste.,6703af3cd312dda4ba75d747,2024-10-07T09:52:24.581Z,0
6703af58d312dda4ba75debb,Sublime aut universe paulatim ascisco vesco.,Reiciendis volva beatae ab. Tubineus fugiat crebro tollo templum peior. Copia contra cribro usque.,6703af37d312dda4ba75d62d,2024-10-07T09:52:24.606Z,0
6703af58d312dda4ba75debd,Nemo aestas tergo tamquam versus vulpes viridis.,Sint possimus abscido magni defessus coadunatio cultura demonstro. In velit quibusdam. Cohors crustulum succurro stillicidium tamdiu voro vis apparatus.,6703af3fd312dda4ba75d7c2,2024-10-07T09:52:24.631Z,0
6703af58d312dda4ba75debf,Molestiae antepono quo taedium defessus terreo congregatio terror vapulus error.,Dicta civitas adhuc crur paens. Maiores deripio stella utrum adiuvo cauda alo tametsi blanditiis. Acervus cogito abutor dolorum.,6703af3ed312dda4ba75d7bf,2024-10-07T09:52:24.654Z,0
6703af58d312dda4ba75dec1,Votum ustulo acceptus cibo acerbitas curriculum vapulus.,Adulatio dedecor aiunt abbas comes sollers. Corona harum capio delectus xiphias. Trans quidem circumvenio.,6703af37d312dda4ba75d618,2024-10-07T09:52:24.683Z,0
6703af58d312dda4ba75dec3,Pax depraedor aurum.,Ipsum articulus in amaritudo capillus teneo cito vix templum uxor. Aduro via artificiose acceptus velit cito angulus vallum. Decens cupiditate thermae audentia atavus cito soluta.,6703af3ad312dda4ba75d6c9,2024-10-07T09:52:24.708Z,0
6703af58d312dda4ba75dec5,Conculco tametsi tantum custodia verecundia.,Odit reprehenderit turpis corona adipiscor repudiandae. Communis animi vaco solutio. Venio magnam ultio esse sortitus aestivus quidem attero cupressus.,6703af37d312dda4ba75d61b,2024-10-07T09:52:24.732Z,0
6703af58d312dda4ba75dec7,Animus spiritus talus appositus vapulus celer debeo caritas aperiam.,Pecco cuius cubitum subnecto bestia tyrannus vallum desino. Molestias absorbeo fugit bardus tergo consequatur contego pecco tabesco decor. Pecus terror bestia sint cupio sulum.,6703af39d312dda4ba75d66f,2024-10-07T09:52:24.755Z,0
6703af58d312dda4ba75dec9,Correptius brevis supplanto delego tenuis voluptatem vetus vilicus.,Conqueror conor ancilla concido. Veritatis cursus assentator curo architecto deficio sortitus subiungo color. Auctor arma rerum suspendo attero.,6703af3ed312dda4ba75d7b3,2024-10-07T09:52:24.779Z,0
6703af58d312dda4ba75decb,Quas ago tribuo vesica nam demergo molestiae enim accommodo molestias.,Adicio color spero vereor cunabula patria. Verus alveus vicinus vorax. Illo capio cotidie anser vobis suscipit.,6703af3cd312dda4ba75d732,2024-10-07T09:52:24.804Z,0
6703af58d312dda4ba75decd,Corporis ars adamo conservo concido quis claustrum assentator admitto atrox.,Degenero velociter architecto voveo. Ter caelum ultra arbor atavus subnecto laudantium corrumpo. Pecco verus abeo amiculum benevolentia tametsi confido tres suus.,6703af42d312dda4ba75d897,2024-10-07T09:52:24.829Z,0
6703af58d312dda4ba75decf,Desolo vespillo abutor.,Perspiciatis clibanus contra hic aperte bardus thermae demens ex. Versus vallum artificiose. Degenero adinventitias error ascit villa cariosus recusandae candidus stabilis sui.,6703af38d312dda4ba75d639,2024-10-07T09:52:24.855Z,0
6703af58d312dda4ba75ded1,Ustilo angustus cubitum eveniet ab comprehendo spiritus.,Depulso timidus assumenda stillicidium adopto desidero quos magni adiuvo coaegresco. Spes subito patrocinor contabesco succedo vehemens vindico attonbitus. Bibo occaecati tamdiu coepi vobis sulum capitulus acies decipio ab.,6703af3bd312dda4ba75d6ed,2024-10-07T09:52:24.881Z,0
6703af58d312dda4ba75ded3,Vigor veniam deludo aliqua admiratio.,Autem subito ultio quae ater tum aveho coadunatio vulariter. Adstringo tui aufero auditor theatrum apostolus. Conservo ter somniculosus.,6703af36d312dda4ba75d5f4,2024-10-07T09:52:24.907Z,0
6703af58d312dda4ba75ded5,Tantillus demergo despecto coniuratio adflicto.,Cornu desino veritas conservo adeo caelestis amiculum. Temeritas spargo suscipio vestrum tricesimus alter caterva tamen censura. A cetera valetudo voluntarius carpo sub unde.,6703af41d312dda4ba75d840,2024-10-07T09:52:24.933Z,0
6703af58d312dda4ba75ded7,Possimus tergum decor.,Conitor velit arbor usitas atrox cometes acquiro vester statua. Cruciamentum deserunt cur conqueror patrocinor impedit quibusdam pel valens. Una absens civitas decretum alo.,6703af40d312dda4ba75d831,2024-10-07T09:52:24.960Z,0
6703af58d312dda4ba75ded9,Suffragium tabernus ipsum ultio beatus.,Tunc virtus at strues tactus centum centum sodalitas. Cubicularis spes sponte aliqua titulus. Cruciamentum degusto somnus careo minima cohors caterva.,6703af41d312dda4ba75d861,2024-10-07T09:52:24.987Z,0
6703af59d312dda4ba75dedb,Adduco acsi ut aequus defendo adopto artificiose bis sono viridis.,Conor fugit crepusculum ducimus amplus viriliter coerceo amaritudo. Cilicium verumtamen casus adeptio cado antiquus adsidue creptio cado. Corona pecco solus.,6703af42d312dda4ba75d87c,2024-10-07T09:52:25.010Z,0
6703af59d312dda4ba75dedd,Curto soluta vix coma enim adicio.,Volo vos tubineus cena tergum denuncio deputo atrox curvo tui. Tribuo abutor adinventitias auditor cumque velociter cupiditate. Una clamo demitto curis toties.,6703af3fd312dda4ba75d7ec,2024-10-07T09:52:25.034Z,0
6703af59d312dda4ba75dedf,Terga aspernatur dignissimos adduco adiuvo cruentus.,Comprehendo vergo carpo inventore. Creptio templum ambulo paens bestia cibo suspendo. Tollo soleo alo apparatus vociferor bardus doloremque perferendis.,6703af38d312dda4ba75d654,2024-10-07T09:52:25.058Z,0
6703af59d312dda4ba75dee1,Cicuta textilis arcus caterva.,Sollers cur supellex solium pauper credo libero. Supellex adipisci conscendo aperio tamisium trepide cornu. Fuga eaque est deprimo adsuesco.,6703af3dd312dda4ba75d771,2024-10-07T09:52:25.084Z,0
6703af59d312dda4ba75dee3,Cado vitae veritatis adopto approbo excepturi somniculosus vulgo tollo.,Copia congregatio defessus numquam tenus vorax sit. Coruscus virga adfero arcesso uxor celer civis audeo. Testimonium denego apto timidus.,6703af41d312dda4ba75d864,2024-10-07T09:52:25.109Z,0
6703af59d312dda4ba75dee5,Defetiscor umerus tenax comptus ter tego harum sophismata cohaero.,Curto ventosus aetas officia animus. Totidem defetiscor tero earum alias. Ademptio aut aegrotatio velit est vapulus.,6703af3bd312dda4ba75d6ea,2024-10-07T09:52:25.134Z,0
6703af59d312dda4ba75dee7,Adfero eaque candidus.,Adduco tego vulnero volup tollo. Corrupti aliqua vilis campana deficio sono vester. Studio pectus molestiae ars audax tabgo.,6703af3fd312dda4ba75d7f8,2024-10-07T09:52:25.164Z,0
6703af59d312dda4ba75dee9,Adipiscor sunt crebro acsi decens quam excepturi.,Ulterius eius charisma. Depraedor sophismata assentator contra speculum patria coerceo. Aequus virga curriculum cito tabesco.,6703af3ed312dda4ba75d789,2024-10-07T09:52:25.190Z,0
6703af59d312dda4ba75deeb,Stabilis vesco tyrannus aqua.,Aeternus vulgaris doloremque provident tenuis. Campana bibo speculum ullam. Vulticulus fugiat illo admiratio vergo canto appono truculenter conor.,6703af3dd312dda4ba75d756,2024-10-07T09:52:25.216Z,0
6703af59d312dda4ba75deed,Taceo quibusdam videlicet rerum coerceo cado.,Adicio aranea timor cursus verecundia acies. Tredecim demonstro administratio aliquid verumtamen conforto. Hic pecus vito.,6703af3dd312dda4ba75d75f,2024-10-07T09:52:25.242Z,0
6703af59d312dda4ba75deef,Tenetur adeptio accusamus tam uredo torrens talus cornu corrupti adopto.,Correptius vitiosus ustulo curso amet crustulum. Deleniti clementia auctor recusandae laudantium adinventitias amiculum civitas. Porro aestas decerno coniuratio.,6703af3cd312dda4ba75d744,2024-10-07T09:52:25.268Z,0
6703af59d312dda4ba75def1,Vigilo exercitationem consequatur conturbo vito temporibus neque.,Demo solitudo conturbo alter corpus corrupti viduo deripio tabgo vorax. Condico talis ciminatio. Asperiores vesica ascit bis adiuvo.,6703af40d312dda4ba75d807,2024-10-07T09:52:25.294Z,0
6703af59d312dda4ba75def3,Bos bestia vir acquiro celer bellicus demoror.,Corporis amoveo speculum. Tenus benevolentia dedico subseco. Arbor repellat ciminatio suffragium taedium vulgus acervus auxilium sustineo auctor.,6703af3cd312dda4ba75d723,2024-10-07T09:52:25.320Z,0
6703af59d312dda4ba75def5,Suasoria cunabula uxor veritatis acies sumo.,Caste commemoro ratione caute atqui aliqua cohaero. Suspendo ex aperiam sono nihil vomica tempore perspiciatis ascit illum. Deleniti canto tabesco adamo benevolentia crux cinis ambulo sufficio.,6703af40d312dda4ba75d834,2024-10-07T09:52:25.343Z,0
6703af59d312dda4ba75def7,Sum demulceo ducimus somnus ventito.,Amplus super inventore repellat. Illo necessitatibus toties ratione vetus verbera dolores contigo vulgivagus absorbeo. Terga aptus abundans antiquus.,6703af39d312dda4ba75d666,2024-10-07T09:52:25.367Z,0
6703af59d312dda4ba75def9,Incidunt agnitio advenio territo voluptatum cribro vox aro nostrum.,Victus cognatus somniculosus vero. Conforto animadverto natus vitae amiculum suus assentator solvo tabula. Vivo cubitum quos vita.,6703af3cd312dda4ba75d71a,2024-10-07T09:52:25.392Z,0
6703af59d312dda4ba75defb,Derelinquo consectetur accommodo tribuo adeptio.,Delego volaticus custodia officia depono sophismata vae aegre. Infit adfero torqueo curso ultio ulterius terebro asper tamquam. Facere vesica varius credo textus comitatus eius artificiose.,6703af3bd312dda4ba75d6e1,2024-10-07T09:52:25.418Z,0
6703af59d312dda4ba75defd,Colligo cometes comburo quia depulso tot tener cornu delibero.,Cito desparatus alveus cuppedia auctor auditor turbo. Coerceo spargo vulpes adflicto adflicto mollitia decipio agnitio. Aetas cetera aqua claro ago cavus agnosco texo temeritas cultura.,6703af42d312dda4ba75d8a3,2024-10-07T09:52:25.443Z,0
6703af59d312dda4ba75deff,Aegrotatio sufficio conforto cunabula supra.,Cura appositus vicissitudo. Terminatio vigor calamitas crudelis adeo ambulo surculus culpa. Iste comburo arma volutabrum accedo.,6703af3dd312dda4ba75d765,2024-10-07T09:52:25.466Z,0
6703af59d312dda4ba75df01,Tempus corporis cetera conatus aer cunabula territo admiratio animus aufero.,Porro coniecto ter xiphias velit vallum atque brevis vomica viriliter. Nihil anser ver adeo laudantium varius cruciamentum conculco defaeco quibusdam. Conturbo attollo tristis conor demonstro.,6703af39d312dda4ba75d678,2024-10-07T09:52:25.491Z,0
6703af59d312dda4ba75df03,Thermae admoneo illum derideo.,Abstergo spargo alveus. Stabilis aequus combibo arbor versus laboriosam. Officiis deripio sublime tui.,6703af41d312dda4ba75d849,2024-10-07T09:52:25.518Z,0
6703af59d312dda4ba75df05,Caute corona theatrum decipio despecto decerno pecus cursim demo civitas.,Beatae cultura aestas stabilis. Corona natus accusamus tunc caput truculenter. Tempore vereor creo dedico amplexus aggero.,6703af3bd312dda4ba75d6db,2024-10-07T09:52:25.543Z,0
6703af59d312dda4ba75df07,Vinco demulceo neque comptus supra pariatur aer est.,Cohibeo civis amitto vitae cum sordeo crustulum ter conspergo summa. Urbanus sophismata amplus. Creta sonitus decumbo ambitus.,6703af3bd312dda4ba75d70e,2024-10-07T09:52:25.569Z,0
6703af59d312dda4ba75df09,Ustulo cenaculum desidero admoneo.,Territo vulgus acerbitas angelus vulpes verecundia. Aperiam sodalitas attonbitus unde. Tabula tepidus tamdiu tergum universe averto itaque commodo caelestis.,6703af42d312dda4ba75d870,2024-10-07T09:52:25.594Z,0
6703af59d312dda4ba75df0b,Crinis convoco accedo advenio collum brevis incidunt celer.,Congregatio curo tibi deludo deprecator cunabula vulnus. Infit arbor creator compello tam speciosus. Corrigo confido aveho bestia adiuvo combibo callide sumo teneo.,6703af38d312dda4ba75d633,2024-10-07T09:52:25.621Z,0
6703af59d312dda4ba75df0d,Asper cohors adimpleo.,Arx volo virga aeger deinde considero verbera annus. Votum degusto porro decet trans tempora tener cui tracto. Administratio sunt vinum trado abundans quod artificiose summopere.,6703af3dd312dda4ba75d777,2024-10-07T09:52:25.646Z,0
6703af59d312dda4ba75df0f,Adfero constans tero apparatus.,Textus argumentum cimentarius confugo commodi atqui facere depereo aro. Adipisci cena esse sophismata antiquus at. Suffoco bellum depulso arbustum cohaero auctor.,6703af3bd312dda4ba75d6fc,2024-10-07T09:52:25.672Z,0
6703af59d312dda4ba75df11,Abeo teres vestrum adsum eos cruentus temptatio volaticus auxilium.,Vilis alius amita minus victus defetiscor perspiciatis. Aestivus utilis adversus eaque patrocinor adflicto quaerat nobis delicate ulterius. Deserunt despecto barba denuncio patrocinor.,6703af3dd312dda4ba75d77d,2024-10-07T09:52:25.698Z,0
6703af59d312dda4ba75df13,Vetus auxilium absum tardus qui concedo allatus.,Vito cupio beneficium universe conqueror. Unus peccatus conduco turpis conitor autem cedo tutamen trado. Terminatio distinctio clibanus beatus tolero curriculum incidunt tamen vobis sui.,6703af3ad312dda4ba75d6ba,2024-10-07T09:52:25.724Z,0
6703af59d312dda4ba75df15,Sollers charisma cimentarius.,Sodalitas traho tamisium aliquam comprehendo ducimus teneo assumenda ait aequus. Defaeco temeritas auctus absque. Debitis conturbo contego aestas tergiversatio dedecor textilis.,6703af3cd312dda4ba75d74a,2024-10-07T09:52:25.749Z,0
6703af59d312dda4ba75df17,Demum undique veritatis adaugeo via.,Fuga bos vicissitudo quia adeptio magnam amaritudo. Cribro certus contra corporis itaque comburo abscido accusantium annus. Dens vero compello talio cohors calculus.,6703af41d312dda4ba75d86d,2024-10-07T09:52:25.773Z,0
6703af59d312dda4ba75df19,Tollo caelum conforto voveo esse tenus amet.,Tracto viduo varietas beatus. Contra baiulus volo pectus titulus umbra aegrotatio. Explicabo cedo repellendus centum.,6703af42d312dda4ba75d888,2024-10-07T09:52:25.798Z,0
6703af59d312dda4ba75df1b,Thymum ocer vomer.,In amet temporibus ipsa magnam. Est vicinus solutio audio summisse volup vito cohibeo subiungo talio. Quos cavus pauper caecus.,6703af39d312dda4ba75d681,2024-10-07T09:52:25.822Z,0
6703af59d312dda4ba75df1d,Reiciendis tersus consuasor triduana amita apparatus.,Censura vobis addo ars tantum defessus ad alter eaque. Vester deprimo sui consuasor claudeo utor vix. Spes thymbra quisquam.,6703af3fd312dda4ba75d7ec,2024-10-07T09:52:25.848Z,0
6703af59d312dda4ba75df1f,Territo corporis theca turba allatus cogito temeritas acervus deprecator appositus.,Auctor ascisco turba deserunt aggero. Studio pauper crepusculum tantum avarus appello adopto adsuesco talus. Desino tondeo sordeo caste crudelis toties.,6703af37d312dda4ba75d603,2024-10-07T09:52:25.874Z,0
6703af59d312dda4ba75df21,Certe quasi tertius tutamen vos arcesso.,Vulgus compono absque decumbo cubicularis. Supellex coaegresco vespillo. Carcer thymbra coma.,6703af39d312dda4ba75d693,2024-10-07T09:52:25.900Z,0
6703af59d312dda4ba75df23,Suppellex tonsor cohors absens cicuta aro.,Utrum venustas unus certus totus tripudio curriculum. Sol supra arca arbor virgo. Chirographum derideo teres verto suggero arbitro calamitas unde velum.,6703af40d312dda4ba75d82b,2024-10-07T09:52:25.926Z,0
6703af59d312dda4ba75df25,Attollo repellendus dens id cito vado thesis.,Demens claudeo conscendo. Utor aliqua timor uxor cultura strenuus minus facere rerum. Cribro aranea vulgivagus tubineus alveus adhaero.,6703af37d312dda4ba75d624,2024-10-07T09:52:25.952Z,0
6703af59d312dda4ba75df27,Cras ascit appositus conor aptus iusto.,Quis aetas atrox ait aduro adinventitias cupiditate temperantia. Cura curis consuasor. Vilicus audeo substantia sint compono cuppedia.,6703af41d312dda4ba75d85e,2024-10-07T09:52:25.977Z,0
6703af5ad312dda4ba75df29,Consuasor defluo adsum tamisium decretum acceptus tyrannus annus debeo cornu.,Audentia tendo socius conventus. Deputo verumtamen thymum spectaculum vulariter venustas vel tum cicuta thesaurus. Victoria aiunt tergo candidus sed color carmen.,6703af41d312dda4ba75d867,2024-10-07T09:52:26.003Z,0
6703af5ad312dda4ba75df2b,Tepesco cupressus tego tracto ademptio error pel spero.,Astrum damnatio umbra torqueo circumvenio caecus bos complectus tolero. Quae amplus texo vallum culpo voluptates. Condico tenuis eum textilis consectetur ex.,6703af37d312dda4ba75d5fa,2024-10-07T09:52:26.027Z,0
6703af5ad312dda4ba75df2d,Approbo adsuesco colligo velit.,Quibusdam sono ipsa. Cinis textus modi uterque aspernatur suffragium patior. Conforto adeptio candidus neque consequuntur cubo textus aspernatur.,6703af3cd312dda4ba75d726,2024-10-07T09:52:26.051Z,0
6703af5ad312dda4ba75df2f,Volva conventus adhuc collum cupressus neque deduco tamquam conor creo.,Valens depraedor correptius ventosus cohaero spoliatio deprecator pauci vomica. Ancilla arx demergo basium. Quidem arbustum custodia totus spectaculum.,6703af39d312dda4ba75d68d,2024-10-07T09:52:26.076Z,0
6703af5ad312dda4ba75df31,Iste rem cura torrens animus thesis labore inventore vulticulus alter.,Quia contabesco vinitor curtus deporto basium adinventitias. Canonicus inflammatio bonus sublime alias velit accusator. Spectaculum vicissitudo vindico consequatur depereo comedo.,6703af3ed312dda4ba75d7ad,2024-10-07T09:52:26.102Z,0
6703af5ad312dda4ba75df33,Vos repellendus voluptatum degenero defendo utpote compono despecto tepidus.,Decet argumentum quasi. Bis vergo utrum coaegresco quam speciosus quibusdam cotidie surgo. Ex tui aveho cruciamentum taceo arca.,6703af3fd312dda4ba75d7e0,2024-10-07T09:52:26.128Z,0
6703af5ad312dda4ba75df35,Aggredior claudeo utrimque audax varius conor.,Crudelis vado brevis catena tremo accendo tyrannus abeo. Possimus suadeo caelestis. Stillicidium contabesco pecto confero.,6703af3ad312dda4ba75d6d2,2024-10-07T09:52:26.151Z,0
6703af5ad312dda4ba75df37,Toties tepidus cubitum.,Adhuc tardus vero. Cariosus concido attollo mollitia perspiciatis ut cura tertius ut coniuratio. Aranea aequitas ventus cubo strues.,6703af3ad312dda4ba75d6ba,2024-10-07T09:52:26.175Z,0
6703af5ad312dda4ba75df39,Rerum abscido coerceo tabesco aer rerum excepturi doloribus vulgo deprecator.,Suus tego volaticus corrigo deripio dapifer. Ipsa curis cupio sustineo arto cubitum cohibeo. Cotidie curo caritas ventosus nisi adsuesco utor.,6703af37d312dda4ba75d61b,2024-10-07T09:52:26.201Z,0
6703af5ad312dda4ba75df3b,Decerno sordeo viscus numquam quasi cavus.,Veritas deporto deserunt ullam vulpes. Varietas aiunt audio accommodo cuius bonus corona anser civis aliquam. Temporibus temptatio pectus.,6703af42d312dda4ba75d870,2024-10-07T09:52:26.226Z,0
6703af5ad312dda4ba75df3d,Solium victoria tamisium tot vomito cura fuga adduco demonstro theologus.,Cauda nemo caute minima benevolentia utrum coma adhuc amiculum. Curtus speciosus eveniet ter timor curvo. Tondeo tenuis depereo autus nobis super.,6703af37d312dda4ba75d5fd,2024-10-07T09:52:26.252Z,0
6703af5ad312dda4ba75df3f,Sponte aptus comminor.,Volutabrum voveo libero deserunt territo beatus solutio comes trepide. Solio damno ubi adfectus adnuo civitas volup. Tristis ciminatio inflammatio degusto aliquid.,6703af40d312dda4ba75d825,2024-10-07T09:52:26.278Z,0
6703af5ad312dda4ba75df41,Venia laudantium artificiose vos corona ager conduco acquiro versus cornu.,Victoria triumphus sono minima verto occaecati avarus. Amaritudo animi valde sodalitas utpote teres vere. Hic magnam averto doloremque spes verumtamen damno.,6703af42d312dda4ba75d87f,2024-10-07T09:52:26.304Z,0
6703af5ad312dda4ba75df43,Despecto necessitatibus aurum summisse labore volva.,Angustus contra stella claudeo audax crinis cattus vilitas thesaurus. Vereor deripio vesica commemoro tum nisi nesciunt texo acquiro. Infit utpote decumbo custodia.,6703af3fd312dda4ba75d7d4,2024-10-07T09:52:26.330Z,0
6703af5ad312dda4ba75df45,Aliquid defaeco delego earum demoror.,Cimentarius thalassinus tabesco desidero conitor vix succedo clamo natus. Tepidus stips utpote calco benevolentia demergo apostolus. Enim adaugeo civis victoria absens eaque thalassinus.,6703af40d312dda4ba75d82e,2024-10-07T09:52:26.356Z,0
6703af5ad312dda4ba75df47,Certe appositus via tenax.,Cerno studio audio territo terminatio certe temporibus. Aro arguo excepturi amor videlicet adipiscor unus vigilo. Vos depromo voveo clam clementia sumptus adfero iusto quis.,6703af42d312dda4ba75d885,2024-10-07T09:52:26.381Z,0
6703af5ad312dda4ba75df49,Quasi curriculum strenuus suscipit adficio.,Adduco adeo auditor ustulo tum adaugeo eos cohibeo vulticulus. Suffoco curiositas cursim admiratio aestus quis abutor adeo. Deleniti corroboro candidus verumtamen adfectus desolo atrox.,6703af3dd312dda4ba75d76b,2024-10-07T09:52:26.407Z,0
6703af5ad312dda4ba75df4b,Chirographum similique videlicet.,Bos concido ipsum vilis. Ater aliqua vorago aperiam tyrannus supellex sunt culpa. Defaeco crapula vinco possimus summisse peccatus tonsor adhaero synagoga.,6703af3dd312dda4ba75d762,2024-10-07T09:52:26.436Z,0
